C1: ABC COMPANY | G1: Tel: (0613) 560 850
C2: 364 Cộng hòa, Q. Tân Bình, Tp.HCM | G2: Fax: (0613) 560 851
C3: Tax code: 0303026656 | G3: Print date : 04/02/2012 15:53
A4: REPORT W/H STOCK CHECKING
A5: W/H Name : | F5: Date: | G5: 04/02/0201 - 04/02/2012
A6: STT | B6: Mã hàng Item Code | C6: Tên hàng Item Description | D6: ĐVT UOM | E6: Lot No | F6: SL Tồn đầu Begin Qty | G6: SL Nhập In Qty | H6: Nhập khác Others In | I6: SL Xuất Out Qty | J6: Xuất khác Others Out | K6: SL Tồn cuối End Qty
A7: 1 | B7: GB401 | C7: GOLF GLOBE MAN'S 42 BLUE | D7: EA | E7: 0 | F7: 10 | G7: 20 | H7: -25 | I7: 201 | J7: 201 | K7: -201
A8: Total | F8: =SUM(F7:F7) -> 10 | G8: =SUM(G7:G7) -> 20 | H8: =SUM(H7:H7) -> -25 | I8: =SUM(I7:I7) -> 201 | J8: =SUM(J7:J7) -> 201 | K8: =SUM(K7:K7) -> -201.00