A1: DAEWON CHEMICAL VINA CO.,LTD
A2: SUPPLIER STOCK INCOME AMOUNT ( From Date ~ To Date )
A3: W/H | B3: SUPPLIER | C3: CCY | D3: IN DATE | E3: REF NO | F3: AMOUNT | G3: EX RATE | H3: TR AMOUNT
A4: OVERSEA | B4: M&K | C4: USD | D4: 40451 | E4: MK100919 | F4: 13997.06 | G4: 13997.06 | H4: =F4*18932 -> 264992339.91999999
F5: =SUM(F4) -> 13997.06 | H5: =SUM(H4) -> 264992339.91999999
A6: TOTAL | F6: =SUM(F5) -> 13997.06 | H6: =SUM(H5) -> 264992339.91999999