A1: CTY TNHH VẬN TẢI TỐC HÀNH KUMHO SAMCO
A2: Tuesday, June 10, 2008
B3: Customer: Code || Name
B4: Date: 01/06/2008 ~ 10/06/2008 | H4: Status: Confirmed | L4: Origin: Domestic
A6: Seq | B6: Voucher No | C6: Trans Date | D6: Proposed By | E6: Ccy | F6: Ex.Rate | G6: Invoice | J6: Customer | L6: Net Amount | N6: VAT | P6: Total Amount | R6: Description | T6: Account Code
G7: Serial | H7: No | I7: Date | J7: Code | K7: Name | L7: Transction | M7: Book | N7: Transction | O7: Book | P7: Transction | Q7: Book | R7: Foreign | S7: Local | T7: Code | U7: Name
A8: 5488 | B8: PT-00611 | C8: 6/2/2008 | D8: tram | E8: VND | F8: 1 | G8: PT-00611 | H8: PT-00611 | I8: 6/2/2008 | J8: DO00062 | K8: Doanh nghiệp tư nhân Thanh Đa | L8: 18974000 | M8: 18974000 | N8: 18974000 | O8: 18974000 | P8: 18974000 | Q8: 18974000 | R8: Thu tiền vé PT-HCM ngày 29,31/5/2008 | S8: Thu tiền vé PT-HCM ngày 29,31/5/2008 | T8: 131100 | U8: A/R Domestci
A9: 5522 | B9: PT-00609 | C9: 6/2/2008 | D9: tram | E9: VND | F9: 1 | G9: PT-00609 | H9: PT-00609 | I9: 6/2/2008 | J9: DO00062 | K9: Doanh nghiệp tư nhân Thanh Đa | L9: 28052000 | M9: 28052000 | N9: 28052000 | O9: 28052000 | P9: 28052000 | Q9: 28052000 | R9: Thu tiền vé BXMĐ ngày 01/6/2008 | S9: Thu tiền vé BXMĐ ngày 01/6/2008 | T9: 131100 | U9: A/R Domestci
A10: 5523 | B10: PT-00612 | C10: 6/2/2008 | D10: tram | E10: VND | F10: 1 | G10: PT-00612 | H10: PT-00612 | I10: 6/2/2008 | J10: DO00062 | K10: Doanh nghiệp tư nhân Thanh Đa | L10: 140000 | M10: 140000 | N10: 140000 | O10: 140000 | P10: 140000 | Q10: 140000 | R10: Thu tiền vé PT-HCM ngày 01/6/2008 | S10: Thu tiền vé PT-HCM ngày 01/6/2008 | T10: 131100 | U10: A/R Domestci
A11: 5526 | B11: PT-00615 | C11: 6/3/2008 | D11: tram | E11: VND | F11: 1 | G11: PT-00615 | H11: PT-00615 | I11: 6/3/2008 | J11: DO00062 | K11: Doanh nghiệp tư nhân Thanh Đa | L11: 18391200 | M11: 18391200 | N11: 18391200 | O11: 18391200 | P11: 18391200 | Q11: 18391200 | R11: Thu tiền vé PT-HCM ngày 01/6/2008 | S11: Thu tiền vé PT-HCM ngày 01/6/2008 | T11: 131100 | U11: A/R Domestci
A12: 5527 | B12: PT-00616 | C12: 6/3/2008 | D12: tram | E12: VND | F12: 1 | G12: PT-00616 | H12: PT-00616 | I12: 6/3/2008 | J12: DO00062 | K12: Doanh nghiệp tư nhân Thanh Đa | L12: 9273400 | M12: 9273400 | N12: 9273400 | O12: 9273400 | P12: 9273400 | Q12: 9273400 | R12: Thu tiền vé PT-HCM ngày 02/6/2008 | S12: Thu tiền vé PT-HCM ngày 02/6/2008 | T12: 131100 | U12: A/R Domestci
A13: 5529 | B13: PT-00617 | C13: 6/3/2008 | D13: tram | E13: VND | F13: 1 | G13: PT-00617 | H13: PT-00617 | I13: 6/3/2008 | J13: DO00062 | K13: Doanh nghiệp tư nhân Thanh Đa | L13: 40965000 | M13: 40965000 | N13: 40965000 | O13: 40965000 | P13: 40965000 | Q13: 40965000 | R13: Hoàn tạm ứng đóng tiền thuê quầy vé + điện nước T4 | S13: Hoàn tạm ứng đóng tiền thuê quầy vé + điện nước T4 | T13: 131100 | U13: A/R Domestci
A14: 5530 | B14: PT-00618 | C14: 6/3/2008 | D14: tram | E14: VND | F14: 1 | G14: PT-00618 | H14: PT-00618 | I14: 6/3/2008 | J14: DO00062 | K14: Doanh nghiệp tư nhân Thanh Đa | L14: 15464000 | M14: 15464000 | N14: 15464000 | O14: 15464000 | P14: 15464000 | Q14: 15464000 | R14: Hoàn tạm ứng đóng tiền điện + nước tháng 3 theo PC số 68 | S14: Hoàn tạm ứng đóng tiền điện + nước tháng 3 theo PC số 68 | T14: 131100 | U14: A/R Domestci
A15: 5548 | B15: PT-00620 | C15: 6/3/2008 | D15: tram | E15: VND | F15: 1 | G15: PT-00620 | H15: PT-00620 | I15: 6/3/2008 | J15: DO00062 | K15: Doanh nghiệp tư nhân Thanh Đa | L15: 420000 | M15: 420000 | N15: 420000 | O15: 420000 | P15: 420000 | Q15: 420000 | R15: Thu tiền 3 vé 02/6,03 vé 03/6/2008 | S15: Thu tiền 3 vé 02/6,03 vé 03/6/2008 | T15: 131100 | U15: A/R Domestci
A16: 5541 | B16: PT-00619 | C16: 6/4/2008 | D16: tram | E16: VND | F16: 1 | G16: PT-00619 | H16: PT-00619 | I16: 6/4/2008 | J16: DO00062 | K16: Doanh nghiệp tư nhân Thanh Đa | L16: 15000000 | M16: 15000000 | N16: 15000000 | O16: 15000000 | P16: 15000000 | Q16: 15000000 | R16: Hoàn tạm ứng theo PC số 96 | S16: Hoàn tạm ứng theo PC số 96 | T16: 131100 | U16: A/R Domestci
A17: 5550 | B17: PT-00621 | C17: 6/4/2008 | D17: tram | E17: VND | F17: 1 | G17: PT-00621 | H17: PT-00621 | I17: 6/4/2008 | J17: DO00062 | K17: Doanh nghiệp tư nhân Thanh Đa | L17: 720000 | M17: 720000 | N17: 720000 | O17: 720000 | P17: 720000 | Q17: 720000 | R17: Thu tiền vé BMT-HCM ngày 30/5/2008 | S17: Thu tiền vé BMT-HCM ngày 30/5/2008 | T17: 131100 | U17: A/R Domestci
A18: 5551 | B18: PT-00622 | C18: 6/4/2008 | D18: tram | E18: VND | F18: 1 | G18: PT-00622 | H18: PT-00622 | I18: 6/4/2008 | J18: DO00062 | K18: Doanh nghiệp tư nhân Thanh Đa | L18: 29243000 | M18: 29243000 | N18: 29243000 | O18: 29243000 | P18: 29243000 | Q18: 29243000 | R18: Thu tiền vé BXMĐ ngày 02/6/2008 | S18: Thu tiền vé BXMĐ ngày 02/6/2008 | T18: 131100 | U18: A/R Domestci
A19: 5552 | B19: PT-00623 | C19: 6/4/2008 | D19: tram | E19: VND | F19: 1 | G19: PT-00623 | H19: PT-00623 | I19: 6/4/2008 | J19: DO00062 | K19: Doanh nghiệp tư nhân Thanh Đa | L19: 10816200 | M19: 10816200 | N19: 10816200 | O19: 10816200 | P19: 10816200 | Q19: 10816200 | R19: Thu tiền vé PT-HCM ngày 03/6/2008 | S19: Thu tiền vé PT-HCM ngày 03/6/2008 | T19: 131100 | U19: A/R Domestci
A20: 5553 | B20: PT-00624 | C20: 6/4/2008 | D20: tram | E20: VND | F20: 1 | G20: PT-00624 | H20: PT-00624 | I20: 6/4/2008 | J20: DO00062 | K20: Doanh nghiệp tư nhân Thanh Đa | L20: 140000 | M20: 140000 | N20: 140000 | O20: 140000 | P20: 140000 | Q20: 140000 | R20: Thu tiền vé PT-HCM ngày 04/6/2008 | S20: Thu tiền vé PT-HCM ngày 04/6/2008 | T20: 131100 | U20: A/R Domestci
A21: TOTAL | E21: VND | L21: =SUM(L8:L20) -> 187598800 | M21: =SUM(M8:M20) -> 187598800 | N21: =SUM(N8:N20) -> 187598800 | O21: =SUM(O8:O20) -> 187598800 | P21: =SUM(P8:P20) -> 187598800 | Q21: =SUM(Q8:Q20) -> 187598800
E22: USD
R24: Giám đốc
C25: Người ghi sổ | L25: Kế toán trưởng | R25: ( Ký, họ tên, đóng dấu )
C26: ( Ký, họ tên ) | L26: ( Ký, họ tên )