A1: PACKING LIST
A2: Shipper/Exporter | F2: Packing No : | G2: 297/2009/HCINT - K & B
A3: HOCHANG INTERNATIONAL CO., LTD | F3: Date : OCT,03,2009
A4: 146-63 GAYANG(1)-DONG, KANGSEO-KU ,SEOUL, KOREA | F4: Contract No : 000111 Contact no
A5: Tel : (82)2-2668-6720 Fax : (82)2 -3661-5258 | F5: Date : OCT,03,2009
A6: For Account & Risk of Messrs | F6: L/C No : 000222 LC no
A7: KIM & BAE TRADING CORP | F7: Remarks
A8: 119 W . 29TH STREET NEW YORK ,NY 10001 | F8: kakaka remaks
A9: Tel : 212-967-0974 Fax : 212-967-8821
A10: Notify Party
A11: SAME AS ABOVE
A12: Port of Loading | D12: Final Destination
A13: HOCHIMINH, VIET NAM
A14: Carrier | D14: Sailing on or About
A15: SINAR BITUNG V214S
A16: Marks and Numbers of PKGS | D16: Description of Goods | F16: Quantity | H16: Unit | I16: Quantity | J16: Unit | K16: Measurement
A19: DEST: | B19: NEW YORK, U.S.A
A20: CARTON No: 1~443
A21: MADE IN VIETNAM
D22: 100% Acrylic sports cap
D23: KB2361EIS | G23: =SUMIF($B$56:$B$268,D23,$G$56:$G$268) -> 0 | H23: Doz | I23: =G23*12 -> 0 | J23: Pcs
D24: 100% Acrylic sports cap
D25: KB2361EJ | G25: =SUMIF($B$56:$B$268,D25,$G$56:$G$268) -> 0 | H25: Doz | I25: =G25*12 -> 0 | J25: Pcs
D26: 100% Acrylic sports cap
D27: KB2361EJ-2TP | G27: =SUMIF($B$56:$B$268,D27,$G$56:$G$268) -> 0 | H27: Doz | I27: =G27*12 -> 0 | J27: Pcs
D28: 100% Acrylic sports cap
D29: KNF2364EC-2T | G29: =SUMIF($B$56:$B$268,D29,$G$56:$G$268) -> 0 | H29: Doz | I29: =G29*12 -> 0 | J29: Pcs
D30: 100% Acrylic sports cap
D31: KNH2364 | G31: =SUMIF($B$56:$B$268,D31,$G$56:$G$268) -> 0 | H31: Doz | I31: =G31*12 -> 0 | J31: Pcs
D32: 100% Acrylic sports cap
D33: KNH2364-AST | G33: =SUMIF($B$56:$B$268,D33,$G$56:$G$268) -> 0 | H33: Doz | I33: =G33*12 -> 0 | J33: Pcs
D34: 100% Acrylic sports cap
D35: KNH2364E-PRPT | G35: =SUMIF($B$56:$B$268,D35,$G$56:$G$268) -> 0 | H35: Doz | I35: =G35*12 -> 0 | J35: Pcs
D36: 100% Acrylic sports cap
D37: KNH2364E-PT | G37: =SUMIF($B$56:$B$268,D37,$G$56:$G$268) -> 0 | H37: Doz | I37: =G37*12 -> 0 | J37: Pcs
D38: 100% Acrylic sports cap
D39: KNW2365 | G39: =SUMIF($B$56:$B$268,D39,$G$56:$G$268) -> 0 | H39: Doz | I39: =G39*12 -> 0 | J39: Pcs
D40: 100% Cotton sports cap
D41: KVT1434ECZ-PT | G41: =SUMIF($B$56:$B$268,D41,$G$56:$G$268) -> 300 | H41: Doz | I41: =G41*12 -> 3600 | J41: Pcs
D42: 100% Cotton sports cap
D43: KVT1434EZ-PT | G43: =SUMIF($B$56:$B$268,D43,$G$56:$G$268) -> 0 | H43: Doz | I43: =G43*12 -> 0 | J43: Pcs
D44: 100% Cotton sports cap
D45: KVT1434EZ-PTPR | G45: =SUMIF($B$56:$B$268,D45,$G$56:$G$268) -> 0 | H45: Doz | I45: =G45*12 -> 0 | J45: Pcs
D46: 100% Cotton sports cap
D47: KVT1434EZ-ZIP | G47: =SUMIF($B$56:$B$268,D47,$G$56:$G$268) -> 0 | H47: Doz | I47: =G47*12 -> 0 | J47: Pcs
D48: 100% Cotton sports cap
D49: KVT1444EZ-PT | G49: =SUMIF($B$56:$B$268,D49,$G$56:$G$268) -> 0 | H49: Doz | I49: =G49*12 -> 0 | J49: Pcs
D50: Beanie sports cap
D51: ZIP395 | G51: =SUMIF($B$56:$B$268,D51,$G$56:$G$268) -> 0 | H51: Doz | I51: =G51*12 -> 0 | J51: Pcs
D52: TOTAL | G52: =SUM(G21:G51) -> 300 | H52: Doz | I52: =SUM(I21:I51) -> 3600 | J52: Pcs
A54: C/T No. | B54: STYLE No. | C54: COLOUR | D54: EMB | E54: QUANTITY | I54: N.WEIGHT | J54: G.WEIGHT | K54: REMARKS
D55: SIZE | E55: PCS | F55: UNIT | G55: DOZ | H55: UNIT | I55: (Kgs) | J55: (Kgs)
A56: 1-10 | B56: KVT1434ECZ-PT | C56: BLK | D56: KBV585-CHECK | E56: =(VALUE(RIGHT(A56,2)-VALUE(LEFT(A56,1)))+1)*144 -> 1440 | F56: Pcs | G56: =E56/12 -> 120 | H56: Doz | I56: =G56 -> 120 | J56: =I56*1.3 -> 156 | K56: 09KB335
A57: 11-14 | B57: KVT1434ECZ-PT | C57: WHT | D57: KBV585-CHECK | E57: =(VALUE(RIGHT(A57,2)-VALUE(LEFT(A57,2)))+1)*144 -> 576 | F57: Pcs | G57: =E57/12 -> 48 | H57: Doz | I57: =G57 -> 48 | J57: =I57*1.3 -> 62.4 | K57: 09KB335
A58: 15-17 | B58: KVT1434ECZ-PT | C58: RED | D58: KBV585-CHECK | E58: =(VALUE(RIGHT(A58,2)-VALUE(LEFT(A58,2)))+1)*144 -> 432 | F58: Pcs | G58: =E58/12 -> 36 | H58: Doz | I58: =G58 -> 36 | J58: =I58*1.3 -> 46.8 | K58: 09KB335
A59: 18-20 | B59: KVT1434ECZ-PT | C59: DBR | D59: KBV585-CHECK | E59: =(VALUE(RIGHT(A59,2)-VALUE(LEFT(A59,2)))+1)*144 -> 432 | F59: Pcs | G59: =E59/12 -> 36 | H59: Doz | I59: =G59 -> 36 | J59: =I59*1.3 -> 46.8 | K59: 09KB335
A60: 21 | B60: KVT1434ECZ-PT | C60: RED | D60: KBV585-CHECK | E60: =(VALUE(RIGHT(A60,2)-VALUE(LEFT(A60,2)))+1)*72 -> 72 | F60: Pcs | G60: =E60/12 -> 6 | H60: Doz | I60: =G60 -> 6 | J60: =I60*1.3 -> 7.8 | K60: 09KB335
A61: 21 | B61: KVT1434ECZ-PT | C61: DBR | D61: KBV585-CHECK | E61: =(VALUE(RIGHT(A61,2)-VALUE(LEFT(A61,2)))+1)*72 -> 72 | F61: Pcs | G61: =E61/12 -> 6 | H61: Doz | I61: =G61 -> 6 | J61: =I61*1.3 -> 7.8 | K61: 09KB335
A62: 22-24 | B62: KVT1434ECZ-PT | C62: KHK | D62: KBV585-CHECK | E62: =(VALUE(RIGHT(A62,2)-VALUE(LEFT(A62,2)))+1)*144 -> 432 | F62: Pcs | G62: =E62/12 -> 36 | H62: Doz | I62: =G62 -> 36 | J62: =I62*1.3 -> 46.8 | K62: 09KB335
A63: 25 | B63: KVT1434ECZ-PT | C63: DGY | D63: KBV585-CHECK | E63: =(VALUE(RIGHT(A63,2)-VALUE(LEFT(A63,2)))+1)*144 -> 144 | F63: Pcs | G63: =E63/12 -> 12 | H63: Doz | I63: =G63 -> 12 | J63: =I63*1.3 -> 15.6 | K63: 09KB335
B64: TOTAL: | E64: =SUM(E56:E247) -> 3600 | G64: =SUM(G56:G247) -> 300 | I64: =SUM(I56:I247) -> 300 | J64: =SUM(J56:J247) -> 390
A66: TOTAL: 443 CTNS
J72: HO CHANG INTERNATIONAL CO., LTD

A1: NEW YORK, U.S.A

A1: 40089