C5: Requesting Department: Golf Course Maint | F5: Expected date of Delivery: 10 days | I5: New Request? New | L5: PR No. | N5: Selected Vendor No.1
C6: Date of Request: 15.04.2010 | I6: Direct issue? Stock
C7: Reason of Request:Caddie towel serve for golf course | F7: Budgeted? Amount | I7: Payment terms: | L7: PO Reference No.
A8: Managed by Watertree
B9: Qty Needed | C9: Unit of Measure | D9: Item Code | E9: Description | F9: Expense Code | G9: Mothly Consumption | H9: Qty on Hand | J9: Unit Price | N9: Total Amount
A10: No. | H10: Qty | I10: Days | J10: Last Order | K10: Vendor-1 | L10: Vendor-2 | M10: Vendor-3
A11: 1 | B11: 600 | E11: Caddie towel | K11: 41500 | N11: =K11*B11 -> 24900000
A18: 2 | B18: 400 | E18: Towel box | K18: 9000 | N18: =K18*B18 -> 3600000
A23: Requested by: | F23: Approved by: | L23: Sub-total | N23: =N11+N18+N19+N20+N21 -> 28500000
A24: Initiator (Name, Position) | E24: Department Head (Name) | F24: Controller | H24: General Manager | J24: Owner Representative | L24: VAT | N24: =N23*10% -> 2850000
A25: Signatures: | L25: sub-total | N25: =SUM(N23, N24) -> 31350000
L26: Other costs (pl specify)
A29: Date: | E29: Date: | F29: Date: | H29: Date: | J29: Date: | L29: Total Amount
A30: Remark: Caddie towel serve for golf course
A33: Notes:
A34: 1. All Purchase Requests (PR), Expenditure Contracts/Agreements with a value of US$25,000 and more require Owner's signatory approval.on the PR / Contract / Agreement
A35: 2. All Purchase Requests (PR), Expenditure Contracts/Agreements for a contract period of 1 year and more require Owner's signatory approval on the PR / Contract / Agreement
A36: 3. All Capex (Capital Expenditure) with a value of US$4,000 and more for each item require Owner's approval signatory on the Purchase Request (PR) / Purchase Contract / Agreement

A1: PURCHASE REQUEST