C5: AP BINH PHUOC A, BINH CHUAN, THUAN AN, BINH DUONG, VIETNAM
C7: ACTUAL PACKING LIST
C8: DATE: | E8: <%=pack_date %> | G8: CUSTOMER : | K8: IN-LINE | M8: STYLE DISC: <%=item_name %>
C9: PO# | E9: <%=po_no %> | G9: ORDER QTY: | K9: <%=order_qty %> | L9: PCS | M9: SHIPPED QTY: | P9: 4932
C10: STYLE# | E10: <%=item_code %> | G10: CARTON QTY: | K10: 15 | M10: CONTAINER#:
C12: PACKING INSTRUCTION: <%=pack_intruc %>
C14: Style | D14: Po | E14: School | F14: S.C | G14: Licensing | H14: Box# | K14: Box's qty
C16: Size Ratio | L16: 2 | M16: 2 | P16: 2 | Q16: 2
C17: class=xl212 style='border-bottom:.5pt solid black;border-top: none'><%=item_code%> | D17: class=xl215 style='border-bottom:.5pt solid black;border-top: none' x:num><%=po_no %> | E17: ALABAMA | F17: 101 | G17: CLC | H17: 1 | I17: ~ | J17: 1 | K17: 1 | L17: 7 | S17: 7 | T17: 7
H18: =J17+1 -> 2 | I18: ~ | J18: =H18+K18-1 -> 2 | K18: 1 | M18: 12 | S18: =+SUM(L18:R18) -> 12 | T18: =S18*$K18 -> 12
H19: =J18+1 -> 3 | I19: ~ | J19: =H19+K19-1 -> 3 | K19: 1 | P19: 21 | S19: =+SUM(L19:R19) -> 21 | T19: =S19*$K19 -> 21
H20: =J19+1 -> 4 | I20: ~ | J20: =H20+K20-1 -> 4 | K20: 1 | S20: =+SUM(L20:R20) -> 0 | T20: =S20*$K20 -> 0
H21: =J20+1 -> 5 | I21: ~ | J21: =H21+K21-1 -> 5 | K21: 1 | S21: =+SUM(L21:R21) -> 0 | T21: =S21*$K21 -> 0
E22: TOTAL: | K22: =SUM(K17:K21) -> 5 | L22: =SUM(L17:L21) -> 7 | M22: =SUM(M17:M21) -> 12 | P22: =SUM(P17:P21) -> 21 | S22: =SUM(S17:S21) -> 40 | T22: =SUM(T17:T21) -> 40
E23: APPALAC ST | F23: 102 | G23: LRG | H23: =J21+1 -> 6 | I23: ~ | J23: =H23+K23-1 -> 6 | K23: 1 | L23: 6 | S23: =+SUM(L23:R23) -> 6 | T23: =S23*$K23 -> 6
H24: =J23+1 -> 7 | I24: ~ | J24: =H24+K24-1 -> 7 | K24: 1 | M24: 15 | S24: =+SUM(L24:R24) -> 15 | T24: =S24*$K24 -> 15
H25: =J24+1 -> 8 | I25: ~ | J25: =H25+K25-1 -> 8 | K25: 1 | P25: 20 | S25: =SUM(L25:R25) -> 20 | T25: =S25*$K25 -> 20
H26: =J25+1 -> 9 | I26: ~ | J26: =H26+K26-1 -> 9 | K26: 1 | S26: =+SUM(L26:R26) -> 0 | T26: =S26*$K26 -> 0
E27: TOTAL: | K27: =SUM(K23:K26) -> 4 | L27: =SUM(L23:L26) -> 6 | M27: =SUM(M23:M26) -> 15 | P27: =SUM(P23:P26) -> 20 | S27: =SUM(S23:S26) -> 41 | T27: =SUM(T23:T26) -> 41
E28: BAYLOR | F28: 120 | G28: CLC | H28: =J26+1 -> 10 | I28: ~ | J28: =H28+K28-1 -> 10 | K28: 1 | L28: 16 | S28: =+SUM(L28:R28) -> 16 | T28: =S28*$K28 -> 16
H29: =J28+1 -> 11 | I29: ~ | J29: =H29+K29-1 -> 11 | K29: 1 | M29: 20 | S29: =+SUM(L29:R29) -> 20 | T29: =S29*$K29 -> 20
H30: =J29+1 -> 12 | I30: ~ | J30: =H30+K30-1 -> 12 | K30: 1 | P30: 24 | S30: =+SUM(L30:R30) -> 24 | T30: =S30*$K30 -> 24
H31: =J30+1 -> 13 | I31: ~ | J31: =H31+K31-1 -> 13 | K31: 1 | S31: =+SUM(L31:R31) -> 0 | T31: =S31*$K31 -> 0
H32: =J31+1 -> 14 | I32: ~ | J32: =H32+K32-1 -> 14 | K32: 1 | S32: =+SUM(L32:R32) -> 0 | T32: =S32*$K32 -> 0
E33: TOTAL: | K33: =SUM(K28:K32) -> 5 | L33: =SUM(L28:L32) -> 16 | M33: =SUM(M28:M32) -> 20 | P33: =SUM(P28:P32) -> 24 | S33: =SUM(S28:S32) -> 60 | T33: =SUM(T28:T32) -> 60
E34: IOWA ST | F34: 205 | G34: LRG | H34: 265 | I34: ~ | J34: 265 | K34: 1 | L34: 6 | M34: 1 | P34: 9 | S34: =+SUM(L34:R34) -> 16 | T34: =S34*$K34 -> 16
E35: TEXAS A&M | F35: 359 | G35: LRG | I35: ~ | M35: 1 | P35: 1 | S35: =+SUM(L35:R35) -> 2 | T35: =S35*$K34 -> 2
E36: OHIO ST | F36: 290 | G36: IND | I36: ~ | M36: 2 | S36: =+SUM(L36:R36) -> 2 | T36: =S36*$K34 -> 2
E37: TOTAL: | K37: =SUM(K34:K36) -> 1 | L37: =SUM(L34:L36) -> 6 | M37: =SUM(M34:M36) -> 4 | P37: =SUM(P34:P36) -> 10 | S37: =SUM(S34:S36) -> 20 | T37: =SUM(T34:T36) -> 20
C38: G.Total | K38: =SUMIF($E$17:$E$37,"TOTAL:",K17:K37) -> 15 | L38: =SUMIF($E$17:$E$37,"TOTAL:",L17:L37) -> 35 | M38: =SUMIF($E$17:$E$37,"TOTAL:",M17:M37) -> 51 | N38: =SUMIF($E$17:$E$37,"TOTAL:",N17:N37) -> 0 | O38: =SUMIF($E$17:$E$37,"TOTAL:",O17:O37) -> 0 | P38: =SUMIF($E$17:$E$37,"TOTAL:",P17:P37) -> 75 | Q38: =SUMIF($E$17:$E$37,"TOTAL:",Q17:Q37) -> 0 | R38: =SUMIF($E$17:$E$37,"TOTAL:",R17:R37) -> 0 | S38: =SUMIF($E$17:$E$37,"TOTAL:",S17:S37) -> 161 | T38: =SUMIF($E$17:$E$37,"TOTAL:",T17:T37) -> 161
E40: SHIPMENT SUMMARY
C41: Style | D41: Po | E41: School | F41: S.C | G41: Licensing | H41: Box# | K41: Box's qty | L41: S | M41: M | P41: L | Q41: XL | R41: 2XL | S41: TTL Per Box | T41: TTL
C42: =E10 -> COTS1408H | D42: =E9 -> 3992 | E42: ALABAMA | F42: 101 | G42: CLC | H42: ORDER Q'TY | L42: 7 | M42: 12 | P42: 21 | Q42: 21 | R42: 12 | T42: =SUM(L42:R42) -> 73
H43: 1ST SHIPPED Q'TY | L43: 8 | M43: 13 | P43: 22 | Q43: 22 | R43: 13 | T43: =SUM(L43:R43) -> 78
H44: 2nd SHIPPED Q'TY | T44: =SUM(L44:R44) -> 0
H45: TTL SHIPPED Q'TY | L45: =SUM(L43:L44) -> 8 | M45: =SUM(M43:M44) -> 13 | P45: =SUM(P43:P44) -> 22 | Q45: =SUM(Q43:Q44) -> 22 | R45: =SUM(R43:R44) -> 13 | T45: =SUM(L45:R45) -> 78
H46: BALANCE | L46: =L45-L42 -> 1 | M46: =M45-M42 -> 1 | P46: =P45-P42 -> 1 | Q46: =Q45-Q42 -> 1 | R46: =R45-R42 -> 1 | T46: =SUM(L46:R46) -> 5
E47: APPLALAC ST | F47: 102 | G47: LRG | H47: ORDER Q'TY | L47: 6 | M47: 15 | P47: 20 | Q47: 20 | R47: 11 | T47: =SUM(L47:R47) -> 72
H48: 1ST SHIPPED Q'TY | L48: 7 | M48: 16 | P48: 20 | Q48: 20 | R48: 13 | T48: =SUM(L48:R48) -> 76
H49: 2nd SHIPPED Q'TY | T49: =SUM(L49:R49) -> 0
H50: TTL SHIPPED Q'TY | L50: =SUM(L48:L49) -> 7 | M50: =SUM(M48:M49) -> 16 | P50: =SUM(P48:P49) -> 20 | Q50: =SUM(Q48:Q49) -> 20 | R50: =SUM(R48:R49) -> 13 | T50: =SUM(L50:R50) -> 76
H51: BALANCE | L51: =L50-L47 -> 1 | M51: =M50-M47 -> 1 | P51: =P50-P47 -> 0 | Q51: =Q50-Q47 -> 0 | R51: =R50-R47 -> 2 | T51: =SUM(L51:R51) -> 4
E52: VIRG TECH | F52: 382 | G52: LRG | H52: ORDER Q'TY | L52: 14 | M52: 16 | P52: 16 | Q52: 16 | R52: 10 | T52: =SUM(L52:R52) -> 72
H53: 1ST SHIPPED Q'TY | L53: 15 | M53: 17 | P53: 17 | Q53: 17 | R53: 11 | T53: =SUM(L53:R53) -> 77
H54: 2nd SHIPPED Q'TY | T54: =SUM(L54:R54) -> 0
H55: TTL SHIPPED Q'TY | L55: =SUM(L53:L54) -> 15 | M55: =SUM(M53:M54) -> 17 | P55: =SUM(P53:P54) -> 17 | Q55: =SUM(Q53:Q54) -> 17 | R55: =SUM(R53:R54) -> 11 | T55: =SUM(L55:R55) -> 77
H56: BALANCE | L56: =L55-L52 -> 1 | M56: =M55-M52 -> 1 | P56: =P55-P52 -> 1 | Q56: =Q55-Q52 -> 1 | R56: =R55-R52 -> 1 | T56: =SUM(L56:R56) -> 5
E57: WISCONSIN | F57: 393 | G57: CLC | H57: ORDER Q'TY | L57: 12 | M57: 14 | P57: 21 | Q57: 16 | R57: 9 | T57: =SUM(L57:R57) -> 72
H58: 1ST SHIPPED Q'TY | L58: 13 | M58: 15 | P58: 22 | Q58: 18 | R58: 9 | T58: =SUM(L58:R58) -> 77
H59: 2nd SHIPPED Q'TY | T59: =SUM(L59:R59) -> 0
H60: TTL SHIPPED Q'TY | L60: =SUM(L58:L59) -> 13 | M60: =SUM(M58:M59) -> 15 | P60: =SUM(P58:P59) -> 22 | Q60: =SUM(Q58:Q59) -> 18 | R60: =SUM(R58:R59) -> 9 | T60: =SUM(L60:R60) -> 77
H61: BALANCE | L61: =L60-L57 -> 1 | M61: =M60-M57 -> 1 | P61: =P60-P57 -> 1 | Q61: =Q60-Q57 -> 2 | R61: =R60-R57 -> 0 | T61: =SUM(L61:R61) -> 5
C62: G.TOTAL: | H62: ORDER Q'TY | L62: =SUMIF($H$42:$J$61,"ORDER Q'TY",L42:L61) -> 39 | M62: =SUMIF($H$42:$J$61,"ORDER Q'TY",M42:M61) -> 57 | N62: =SUMIF($H$42:$J$61,"ORDER Q'TY",N42:N61) -> 0 | O62: =SUMIF($H$42:$J$61,"ORDER Q'TY",O42:O61) -> 0 | P62: =SUMIF($H$42:$J$61,"ORDER Q'TY",P42:P61) -> 78 | Q62: =SUMIF($H$42:$J$61,"ORDER Q'TY",Q42:Q61) -> 73 | R62: =SUMIF($H$42:$J$61,"ORDER Q'TY",R42:R61) -> 42 | S62: =SUMIF($H$42:$J$61,"ORDER Q'TY",S42:S61) -> 0 | T62: =SUMIF($H$42:$J$61,"ORDER Q'TY",T42:T61) -> 289
H63: 1ST SHIPPED Q'TY | L63: =SUMIF($H$42:$J$61,"1ST SHIPPED Q'TY",L42:L61) -> 43 | M63: =SUMIF($H$42:$J$61,"1ST SHIPPED Q'TY",M42:M61) -> 61 | N63: =SUMIF($H$42:$J$61,"1ST SHIPPED Q'TY",N42:N61) -> 0 | O63: =SUMIF($H$42:$J$61,"1ST SHIPPED Q'TY",O42:O61) -> 0 | P63: =SUMIF($H$42:$J$61,"1ST SHIPPED Q'TY",P42:P61) -> 81 | Q63: =SUMIF($H$42:$J$61,"1ST SHIPPED Q'TY",Q42:Q61) -> 77 | R63: =SUMIF($H$42:$J$61,"1ST SHIPPED Q'TY",R42:R61) -> 46 | S63: =SUMIF($H$42:$J$61,"1ST SHIPPED Q'TY",S42:S61) -> 0 | T63: =SUMIF($H$42:$J$61,"1ST SHIPPED Q'TY",T42:T61) -> 308
H64: 2nd SHIPPED Q'TY | L64: =SUMIF($H$42:$J$61,"2nd SHIPPED Q'TY",L42:L61) -> 0 | M64: =SUMIF($H$42:$J$61,"2nd SHIPPED Q'TY",M42:M61) -> 0 | N64: =SUMIF($H$42:$J$61,"2nd SHIPPED Q'TY",N42:N61) -> 0 | O64: =SUMIF($H$42:$J$61,"2nd SHIPPED Q'TY",O42:O61) -> 0 | P64: =SUMIF($H$42:$J$61,"2nd SHIPPED Q'TY",P42:P61) -> 0 | Q64: =SUMIF($H$42:$J$61,"2nd SHIPPED Q'TY",Q42:Q61) -> 0 | R64: =SUMIF($H$42:$J$61,"2nd SHIPPED Q'TY",R42:R61) -> 0 | S64: =SUMIF($H$42:$J$61,"2nd SHIPPED Q'TY",S42:S61) -> 0 | T64: =SUMIF($H$42:$J$61,"2nd SHIPPED Q'TY",T42:T61) -> 0
H65: TTL SHIPPED Q'TY | L65: =SUMIF($H$42:$J$61,"TTL SHIPPED Q'TY",L42:L61) -> 43 | M65: =SUMIF($H$42:$J$61,"TTL SHIPPED Q'TY",M42:M61) -> 61 | N65: =SUMIF($H$42:$J$61,"TTL SHIPPED Q'TY",N42:N61) -> 0 | O65: =SUMIF($H$42:$J$61,"TTL SHIPPED Q'TY",O42:O61) -> 0 | P65: =SUMIF($H$42:$J$61,"TTL SHIPPED Q'TY",P42:P61) -> 81 | Q65: =SUMIF($H$42:$J$61,"TTL SHIPPED Q'TY",Q42:Q61) -> 77 | R65: =SUMIF($H$42:$J$61,"TTL SHIPPED Q'TY",R42:R61) -> 46 | S65: =SUMIF($H$42:$J$61,"TTL SHIPPED Q'TY",S42:S61) -> 0 | T65: =SUMIF($H$42:$J$61,"TTL SHIPPED Q'TY",T42:T61) -> 308
H66: BALANCE | L66: =SUMIF($H$42:$J$61,"BALANCE",L42:L61) -> 4 | M66: =SUMIF($H$42:$J$61,"BALANCE",M42:M61) -> 4 | N66: =SUMIF($H$42:$J$61,"BALANCE",N42:N61) -> 0 | O66: =SUMIF($H$42:$J$61,"BALANCE",O42:O61) -> 0 | P66: =SUMIF($H$42:$J$61,"BALANCE",P42:P61) -> 3 | Q66: =SUMIF($H$42:$J$61,"BALANCE",Q42:Q61) -> 4 | R66: =SUMIF($H$42:$J$61,"BALANCE",R42:R61) -> 4 | S66: =SUMIF($H$42:$J$61,"BALANCE",S42:S61) -> 0 | T66: =SUMIF($H$42:$J$61,"BALANCE",T42:T61) -> 19