A1: <%=p_company_name%>
A2: <%=p_cmp_add%>
A3: BẢNG PHÂN BỔ CHI PHÍ TRÍCH TRƯỚC THÁNG <%=p_Month_to%>
A5: STT | B5: Mã | C5: Tài sản | D5: Nguyên giá | E5: Thời gian phân bổ | F5: Thời gian bắt đầu phân bổ | G5: Thời gian kết thúc phân bổ | H5: Tổng giá trị phân bổ | I5: Giá trị phân bổ tháng này | J5: Giá trị phân bổ lũy kế tháng trước | K5: Giá trị phân bổ lũy kế tháng này | L5: Giá trị còn lại | M5: Ghi chú
A6: 1 | C6: =+A6+1 -> 2 | D6: =+C6+1 -> 3 | E6: =+D6+1 -> 4 | F6: =+E6+1 -> 5 | G6: =+F6+1 -> 6 | H6: =+G6+1 -> 7 | I6: 8=7/4 | J6: 9 | K6: 10 = 8 + 9 | L6: 11=7-10 | M6: 12
A7: I | C7: Phân bổ chi phí trả trước ngắn hạn
A8: <%=k+1%> | B8: <%=dt.Rows[i][0]%> | C8: <%=dt.Rows[i][1]%> | D8: <%=dt.Rows[i][2]%> | E8: <%=dt.Rows[i][3]%> | F8: <%=dt.Rows[i][4]%> | G8: <%=dt.Rows[i][5]%> | H8: <%=dt.Rows[i][6]%> | I8: <%=dt.Rows[i][7]%> | J8: <%=dt.Rows[i][8]%> | K8: <%=dt.Rows[i][9]%> | L8: <%=dt.Rows[i][10]%> | M8: <%=dt.Rows[i][11]%>
C9: Tổng | D9: <%=nguyengia %> | H9: <%=tong_gtripb%> | I9: <%=pb_thangnay%> | J9: <%=pblk_thangtruoc%> | K9: <%=pblk_thangnay %> | L9: <%=conlai %>