A2: DAILY PRODUCTION REPORT
A6: DATE : | B6: <%=_prod_date %> | C6: UNIT : | D6: PRS.
A7: KNITTING SECTION | P7: REMARKS
A8: Needle | B8: M/C Q'TY | C8: TARGET Q'TY | D8: M/C RUNNING | F8: PROD. Q'TY | G8: RE-KNITTING | H8: % | I8: B-GRADE | J8: % | K8: C-GRADE | L8: % | M8: TOTAL PROD. | N8: % | O8: MINI WHS STOCK
D9: day shift | E9: night shift
A10: <%=dt.Rows[i]["needle"]%> | B10: <%=dt.Rows[i]["machine_num"]%> | C10: <%=dt.Rows[i]["capa"]%> | D10: <%=dt.Rows[i]["day_run_qty"]%> | E10: <%=dt.Rows[i]["night_run_qty"]%> | F10: <%=dt.Rows[i]["knit_qty"]%> | G10: <%=dt.Rows[i]["re_knit_qty"]%> | H10: =(F<%=row+i%>+G<%=row+i%>)/C<%=row+i%> -> 0% | I10: <%=dt.Rows[i]["b_grade_qty"]%> | J10: =I<%=row+i%>/(F<%=row+i%>+G<%=row+i%>) -> 0% | K10: <%=dt.Rows[i]["c_grade_qty"]%> | L10: =K<%=row+i%>/(F<%=row+i%>+G<%=row+i%>) -> 0% | M10: =F<%=row+i%>+G<%=row+i%>+I<%=row+i%>+K<%=row+i%> -> 1 | N10: =M<%=row+i%>/C<%=row+i%> -> 0%
A11: TOTAL | B11: =SUM(B<%=row%>:B<%=row + dt.Rows.Count-1%>) -> 192 | C11: =SUM(C<%=row%>:C<%=row + dt.Rows.Count-1%>) -> 50,725 | D11: =SUM(D<%=row%>:D<%=row + dt.Rows.Count-1%>) ->  | E11: =SUM(E<%=row%>:E<%=row + dt.Rows.Count-1%>) ->  | F11: =SUM(F<%=row%>:F<%=row + dt.Rows.Count-1%>) ->  | G11: =SUM(G<%=row%>:G<%=row + dt.Rows.Count-1%>) ->  | H11: =(F<%=row + dt.Rows.Count %>+G<%=row + dt.Rows.Count %>)/C<%=row + dt.Rows.Count %> -> 0% | I11: =SUM(I<%=row%>:I<%=row + dt.Rows.Count-1%>) -> 1 | J11: =I<%=row + dt.Rows.Count %>/(F<%=row + dt.Rows.Count %>+G<%=row + dt.Rows.Count %>) -> 13% | K11: =SUM(K<%=row %>:K<%=row + dt.Rows.Count-1%>) ->  | L11: =K<%=row + dt.Rows.Count  %>/(F<%=row + dt.Rows.Count  %>+G<%=row + dt.Rows.Count  %>) -> ##### | M11: =SUM(M<%=row %>:M<%=row + dt.Rows.Count-1%>) ->  | N11: =M<%=row + dt.Rows.Count  %>/C<%=row + dt.Rows.Count  %> -> 2% | O11: <%=dt_wh.Rows[0]["stock_qty"]%> | P11: (2 shift)
A13: LINKING SECTION
A14: Line | B14: M/C Q'TY | C14: TARGET Q'TY | D14: M/C RUNNING | F14: PROD. Q'TY | G14: RE-LOOPING | H14: % | I14: MENDING | K14: CUTTER | M14: DAMAGE
A15: <%=dt.Rows[i]["line_id"]%> | B15: <%=dt.Rows[i]["machine_num"]%> | C15: <%=dt.Rows[i]["capa"]%> | D15: <%=dt.Rows[i]["day_run_qty"]%> | F15: <%=dt.Rows[i]["prod_qty"]%> | G15: <%=dt.Rows[i]["re_looping_qty"]%> | H15: =(G<%=row+i%>+F<%=row+i%>)/C<%=row+i%> -> 14% | I15: <%=dt.Rows[i]["mending_qty"]%> | J15: =I<%=row+i%>/(F<%=row+i%>+G<%=row+i%>) -> - | K15: <%=dt.Rows[i]["cutter_qty"]%> | L15: =K<%=row+i%>/(F<%=row+i%>+G<%=row+i%>) -> 0% | M15: <%=dt.Rows[i]["damage_qty"]%> | N15: =M<%=row+i%>/(F<%=row+i%>+G<%=row+i%>) -> 0%
A16: TOTAL | B16: =SUM(B<%=row%>:B<%=row+dt.Rows.Count-1%>) ->  | C16: =SUM(C<%=row%>:C<%=row+dt.Rows.Count-1%>) ->  | D16: =SUM(D<%=row%>:D<%=row+dt.Rows.Count-1%>) -> 0 | F16: =SUM(F<%=row%>:F<%=row+dt.Rows.Count-1%>) ->  | G16: =SUM(G<%=row%>:G<%=row+dt.Rows.Count-1%>) ->  | H16: =(G<%=row+dt.Rows.Count%>+F<%=row+dt.Rows.Count%>)/C<%=row+dt.Rows.Count%> -> 2%
A18: INSPECTION SECTION
A19: RECORDER | B19: INSPECTOR | C19: TARGET Q'TY | F19: PROD. Q'TY | G19: MENDING | H19: % | I19: B-GRADE | J19: % | K19: C-GRADE | L19: % | M19: TOTAL PROD. | N19: % | O19: MINI WHS STOCK
A20: <%=dt.Rows[i]["line_id"]%> | B20: <%=dt.Rows[i]["machine_num"]%> | C20: <%=dt.Rows[i]["capa"]%> | F20: <%=dt.Rows[i]["prod_qty"]%> | G20: <%=dt.Rows[i]["mending_qty"]%> | H20: =G<%=row+i%>/F<%=row+i%> -> #DIV/0! | I20: <%=dt.Rows[i]["b_qty"]%> | J20: =I<%=row+i%>/F<%=row+i%> -> #DIV/0! | K20: <%=dt.Rows[i]["c_qty"]%> | L20: =K<%=row+i%>/F<%=row+i%> -> ##### | M20: =F<%=row+i%>+G<%=row+i%>+I<%=row+i%>+K<%=row+i%> ->  | N20: =M<%=row+i%>/C<%=row+i%> -> 0 | Q20: =O32-42548 -> 
O21: <%=dt_wh.Rows[1]["stock_qty"]%>
A23: SETTING SECTION
A24: M/C | B24: OPERATOR | C24: TARGET Q'TY | F24: PROD. Q'TY | G24: PRE-SETTING | H24: % | I24: WASHING | J24: %
A25: <%=dt.Rows[i]["line_id"]%> | C25: 15,000 | F25: <%=dt.Rows[i]["setting_qty"]%> | G25: <%=dt.Rows[i]["pre_setting_qty"]%> | H25: =(F<%=row+i%>+G<%=row+i%>)/C<%=row+i%> -> 0% | I25: <%=dt.Rows[i]["ws_setting_qty"]%> | J25: =I<%=row+i%>/C<%=row+i%> -> 0%
A26: TOTAL | B26: =SUM(B<%=row%>:B<%=row+dt.Rows.Count-1%>) -> 18 | C26: =SUM(C<%=row%>:C<%=row+dt.Rows.Count-1%>) -> 45,000 | F26: =SUM(F<%=row%>:F<%=row+dt.Rows.Count-1%>) ->  | H26: =F<%=row+1%>/C<%=row+dt.Rows.Count%> -> 2%
A28: PAIRING SECTION
A29: TABLE | B29: PAIRER | C29: TARGET Q'TY | F29: PROD. Q'TY | G29: BACK SETTING | H29: % | I29: WASHING | J29: % | K29: MENDING | L29: % | M29: DAMAGE | N29: %
A30: <%=dt.Rows[i]["line_id"]%> | B30: <%=dt.Rows[i]["machine_num"]%> | C30: <%=dt.Rows[i]["capa"]%> | F30: <%=dt.Rows[i]["prod_qty"]%> | G30: <%=dt.Rows[i]["bck_set_qty"]%> | H30: =G<%=row+i%>/F<%=row+i%> -> 5% | I30: <%=dt.Rows[i]["washing_qty"]%> | J30: =I<%=row+i%>/F<%=row+i%> -> 0% | K30: <%=dt.Rows[i]["mending_qty"]%> | L30: =K<%=row+i%>/F<%=row+i%> -> 0 | M30: <%=dt.Rows[i]["damage_qty"]%> | N30: =M<%=row+i%>/F<%=row+i%> -> 0%
A31: TOTAL | B31: =SUM(B<%=row%>:B<%=row+dt.Rows.Count-1%>) -> 19 | C31: =SUM(C<%=row%>:C<%=row+dt.Rows.Count-1%>) -> 57,000 | F31: =SUM(F<%=row%>:F<%=row+dt.Rows.Count-1%>) ->  | G31: =SUM(G<%=row%>:G<%=row+dt.Rows.Count-1%>) ->  | H31: =F<%=row+dt.Rows.Count%>/C<%=row+dt.Rows.Count%> -> 35% | I31: =SUM(I<%=row%>:I<%=row+dt.Rows.Count-1%>) ->  | J31: 0% | K31: =SUM(K<%=row%>:K<%=row+dt.Rows.Count-1%>) -> 0 | L31: 0% | N31: 0%
A33: CUTTING SECTION
A34: TABLE | B34: CUTTER | C34: TARGET Q'TY | F34: PROD. Q'TY | H34: %
A35: <%=dt.Rows[i]["line_id"]%> | B35: <%=dt.Rows[i]["machine_num"]%> | C35: <%=dt.Rows[i]["capa"]%> | F35: <%=dt.Rows[i]["prod_qty"]%> | H35: =F<%=row+i%>/C<%=row+i%> -> 0
A36: TOTAL | C36: =SUM(C<%=row%>:C<%=row+dt.Rows.Count-1%>) -> 2,000 | F36: =SUM(F53) -> 0 | H36: =G<%=row+dt.Rows.Count%>/F<%=row+dt.Rows.Count%> -> 0
A38: SEWING SECTION
A39: M/C | B39: SEWER | C39: TARGET Q'TY | F39: PROD.Q'TY | H39: %
A40: <%=dt.Rows[i]["line_id"]%> | B40: <%=dt.Rows[i]["machine_num"]%> | C40: <%=dt.Rows[i]["capa"]%> | F40: <%=dt.Rows[i]["prod_qty"]%> | H40: =F<%=row+i%>/C<%=row+i%> -> 0%
A41: TOTAL | C41: =SUM(C<%=row%>:C<%=row+dt.Rows.Count-1%>) -> 600 | F41: =SUM(F<%=row%>:F<%=row+dt.Rows.Count-1%>) -> 0 | H41: =F<%=row+dt.Rows.Count%>/C<%=row+dt.Rows.Count%> -> 0
A43: LABEL SECTION
A44: M/C | B44: LABELER | C44: TARGET Q'TY | F44: LABEL Q'TY | H44: %
A45: <%=dt.Rows[i]["line_id"]%> | B45: <%=dt.Rows[i]["line_name"]%> | C45: <%=dt.Rows[i]["capa"]%> | F45: <%=dt.Rows[i]["prod_qty"]%> | H45: =F<%=row+i%>/C<%=row+i%> -> 0%
A46: TOTAL | C46: =SUM(C<%=row%>:C<%=row+dt.Rows.Count-1%>) -> 70000 | F46: =SUM(F<%=row%>:F<%=row+dt.Rows.Count-1%>) -> 0 | H46: =F<%=row+dt.Rows.Count%>/C<%=row+dt.Rows.Count%> -> 0
A48: PACKING SECTION
A49: PACKING | B49: PACKER | C49: TARGET Q'TY | F49: PACKED Q'TY | H49: %
A50: <%=dt.Rows[i]["line_id"]%> | B50: <%=dt.Rows[i]["line_name"]%> | C50: <%=dt.Rows[i]["capa"]%> | F50: <%=dt.Rows[i]["prod_qty"]%> | H50: =F<%=row+i%>/C<%=row+i%> -> 0
A51: TOTAL | C51: =SUM(C<%=row%>:C<%=row+dt.Rows.Count-1%>) -> 80000 | F51: 0 | H51: =F<%=row+dt.Rows.Count%>/C<%=row+dt.Rows.Count%> -> 0

A1: S&J HOSIERY(VIETNAM) Co.,LTD