D1: 약칠작업현황 Component Balance
D2: P/O No : P/O No | I2: Style : style | O2: Buyer : buyer
D3: W/P Type: W/P type | I3: Spec : spec | L3: Target : target | O3: Date : 20/11/2011
A4: No | B4: PATTERN NO | D4: Comp ID-Name | E4: In Qty | F4: Req Qty | G4: BF Qty | H4: D1 | I4: D2 | J4: D3 | K4: D4 | L4: D5 | M4: D6 | N4: D7 | O4: D8 | P4: D9 | Q4: D10 | R4: Bal | S4: Prod (%)
A5: 10 | B5: 6;108 | D5: ĐỆM LOGO TRƯỚC | E5: 1 | F5: 2100 | G5: 15 | H5: 20 | I5: 5 | J5: 2 | K5: 3 | L5: 4 | M5: 8 | N5: 7 | O5: 6 | P5: 5 | Q5: 4 | R5: =F5-Q6 -> 2021 | S5: =R5/F5 -> 0.96238095238095234
H6: =H5+G5 -> 35 | I6: =H6+I5 -> 40 | J6: =I6+J5 -> 42 | K6: =J6+K5 -> 45 | L6: =K6+L5 -> 49 | M6: =L6+M5 -> 57 | N6: =M6+N5 -> 64 | O6: =N6+O5 -> 70 | P6: =O6+P5 -> 75 | Q6: =P6+Q5 -> 79

A1: Image