A2: DAILY PRODUCTION REPORT
A6: DATE : | B6: <%=_prod_date %> | C6: UNIT : | D6: PRS.
A7: KNITTING SECTION | P7: REMARKS
A8: Needle | B8: M/C Q'TY | C8: TARGET Q'TY | D8: M/C RUNNING | F8: PROD. Q'TY | G8: RE-KNITTING | H8: % | I8: B-GRADE | J8: % | K8: C-GRADE | L8: % | M8: TOTAL PROD. | N8: % | O8: MINI WHS STOCK
D9: day shift | E9: night shift
A10: <%=dt1.Rows[i]["line_name"] %> | B10: 61 | C10: <%=dt1.Rows[i]["target_qty"] %> | F10: <%=dt1.Rows[i]["prod_qty"] %> | G10: <%=dt1.Rows[i]["re_knit_qt"] %> | H10: =(F<%=row+i+1 %>+G<%=row+i+1 %>)/C<%=row+i+1 %> ->  | I10: <%=dt1.Rows[i]["quality"]%> | J10: =I<%=row+i+1 %>/(F<%=row+i+1 %>+G<%=row+i+1 %>) ->  | K10: <%=dt1.Rows[i]["damage"]%> | L10: =K<%=row+i+1 %>/(F<%=row+i+1 %>+G<%=row+i+1 %>) ->  | M10: =F<%=row+i+1 %>+G<%=row+i+1 %>+I<%=row+i+1 %>+K<%=row+i+1 %> ->  | N10: =M<%=row+i+1 %>/C<%=row+i+1 %> -> 
A11: TOTAL | P11: 7AM ~7AM (2 shift)
A13: LINKING SECTION
A14: Line | B14: M/C Q'TY | C14: TARGET Q'TY | D14: M/C RUNNING | F14: PROD. Q'TY | G14: RE-LOOPING | H14: % | I14: MENDING | K14: CUTTER | M14: DAMAGE
A15: Line 1 | B15: 10 | H15: =(G21+F21)/C21 -> 0 | J15: 0% | L15: 0% | N15: 0%
A16: Line 2 | B16: 10 | C16: =10*1100 -> 11000 | H16: =(G22+F22)/C22 -> 0 | J16: 0% | L16: 0% | N16: 0%
A17: Line 3 | B17: 10 | C17: =10*900 -> 9000 | H17: =(G23+F23)/C23 -> 0 | J17: 0% | L17: 0% | N17: 0%
A18: Line 4 | B18: 10 | C18: =10*900 -> 9000 | H18: =(G24+F24)/C24 -> 0 | J18: 0% | L18: 0% | N18: 0%
A19: CONTI | B19: 2 | C19: =2000*2 -> 4000 | H19: =(G25+F25)/C25 -> 0 | J19: 0% | L19: 0% | N19: 0%
A20: ROSSO | B20: 10 | C20: =12*3000 -> 36000 | H20: =(G26+F26)/C26 -> 0 | J20: 0% | L20: 0% | N20: 0%
A21: HEMMING | B21: 1 | C21: 600 | H21: =(G27+F27)/C27 -> 0 | J21: 0% | L21: 0% | N21: 0%
A22: TOTAL | P22: 7AM~5PM
A24: INSPECTION SECTION
A25: RECORDER | B25: INSPECTOR | C25: TARGET Q'TY | F25: PROD. Q'TY | G25: MENDING | H25: % | I25: B-GRADE | J25: % | K25: C-GRADE | L25: % | M25: TOTAL PROD. | N25: % | O25: MINI WHS STOCK
A26: IN001 | B26: 47 | C26: =B32*1000 -> 47000 | J26: 0% | L26: 0% | M26: =F32+K32 -> 0 | N26: =M32/C32 -> 0 | Q26: =O32-42548 -> -42548
P27: 7AM~5PM
A29: SETTING SECTION
A30: M/C | B30: OPERATOR | C30: TARGET Q'TY | F30: PROD. Q'TY | G30: PRE-SETTING | H30: % | I30: WASHING
A31: ST001 | B31: 6 | C31: 15000 | H31: =F37/C37 -> 0
A32: ST002 | B32: 6 | C32: 15000 | H32: =F38/C38 -> 0
A33: ST003 | B33: 6 | C33: 15000 | H33: =F39/C39 -> 0
P34: 7AM~5PM
A35: TOTAL
A37: PAIRING SECTION
A38: TABLE | B38: PAIRER | C38: TARGET Q'TY | F38: PROD. Q'TY | G38: BACK SETTING | H38: % | I38: WASHING | J38: % | K38: MENDING | L38: % | M38: DAMAGE | N38: %
A39: PR001 | B39: 6 | C39: =3000*6 -> 18000 | H39: =F45/C45 -> 0 | J39: 0% | L39: 0% | N39: 0%
A40: PR002 | B40: 6 | C40: =3000*6 -> 18000 | H40: =F46/C46 -> 0 | J40: 0% | L40: 0% | N40: 0%
A41: PR003 | B41: 6 | C41: =3000*6 -> 18000 | H41: =F47/C47 -> 0 | J41: 0% | L41: 0% | N41: 0% | P41: 7AM~5PM
A43: TOTAL | J43: 0% | L43: 0% | N43: 0%
A45: CUTTING SECTION
A46: TABLE | B46: CUTTER | C46: TARGET Q'TY | F46: PROD. Q'TY | H46: %
A47: 1 | B47: 3 | C47: 2000 | H47: =F53/C53 -> 0
A48: TOTAL
A49: SEWING SECTION
A50: M/C | B50: SEWER | C50: TARGET Q'TY | F50: PROD.Q'TY | H50: %
A51: SW001 | C51: 600 | H51: =F57/C57 -> 0
A52: SW002 | C52: 600 | H52: =F58/C58 -> 0
A53: SW003 | C53: 600 | H53: =F59/C59 -> 0
A54: SW004 | C54: 600 | H54: =F60/C60 -> 0
A55: SW005 | C55: 600 | H55: =F61/C61 -> 0
A56: SW006 | C56: 600 | H56: =F62/C62 -> 0
A58: TOTAL | F58: =SUM(F57:F58) -> 0
A60: LABEL SECTION
A61: M/C | B61: LABELER | C61: TARGET Q'TY | F61: LABEL Q'TY | H61: %
A62: LA001 | B62: LA001 | C62: 10000 | H62: =F68/C68 -> 0
A63: LA002 | B63: LA002 | C63: 10000 | H63: =F69/C69 -> 0
A64: LA003 | B64: LA003 | C64: 10000 | H64: =F70/C70 -> 0
A65: LA004 | B65: LA004 | C65: 10000 | H65: =F71/C71 -> 0
A66: LA005 | B66: BY HAND | C66: 30000 | H66: =F72/C72 -> 0 | P66: 7AM~5PM
A67: TOTAL
A69: PACKING SECTION
A70: PACKING | B70: PACKER | C70: TARGET Q'TY | F70: PACKED Q'TY | H70: %
A71: PK001 | B71: OIC-PHUNG | C71: 20000 | H71: =F77/C77 -> 0 | P71: 7AM~5PM
A72: PK002 | B72: OIC-LAN | C72: 20000 | H72: =F78/C78 -> 0
A73: PK003 | B73: OIC-CHUNG | C73: 20000 | H73: =F79/C79 -> 0
A74: PK004 | B74: OIC-LUAN | C74: 20000 | H74: =F80/C80 -> 0
A75: TOTAL

A1: S&J HOSIERY(VIETNAM) Co.,LTD

A1: =10*1400 -> 14000