A2: Tên đơn vị: <%=dt_name.Rows[0][0].ToString() %> | J2: Số:..........Tháng <%=p_rpt_month.Substring(4,2) %> Năm <%=p_rpt_month.Substring(0,4) %> | W2: Đơn vị cần ghi đầy đủ các tiêu chí từ cột 1 đến cột 26 | AA2: Tháng báo cáo | AB2: Lương trần | AC2: Lương tối thiểu chung | AD2: Lãi Truy Thu
A3: Mã đơn vị: <%=dt_name.Rows[1][0].ToString() %> | P3: Mẫu D02-TS (Ban hành kèm theo QĐsố 1111/QĐ-BHXH ngày 25/10/2011 của BHXH VN) | AD3: BHXH | AE3: BHYT | AF3: BHTN
A4: Địa chỉ: <%=dt_name.Rows[2][0].ToString() %> | AA4: =DATE(<%= p_rpt_month.Substring(0, 4).ToString()%>,<%= p_rpt_month.Substring(4, 2).ToString()%>,1) ->  | AB4: 16600000 | AC4: 830000 | AD4: 0,875% | AE4: 7.4999999999999997E-3 | AF4: 8.7500000000000008E-3
A5: Điện thoại liên hệ: <%=dt_name.Rows[12][0].ToString() %>
A6: A. PHẦN CHI TIẾT
A7: Số TT | B7: Họ và tên | C7: Số sổ BHXH | D7: Ngày tháng năm sinh | E7: Nữ (x) | F7: Nơi khám chữa bệnh | H7: Số CMND | I7: Cấp bậc, c/vụ, chức danh nghề, đ/kiện, nơi làm việc | J7: Mức đóng cũ | N7: Mức đóng mới | R7: Từ tháng năm | S7: Đến tháng năm | T7: Tỷ lệ bổ sung | U7: Đã có sổ BHXH(x) | V7: Ghi Chú | W7: Mã Phòng ban | X7: Ngày cấp | Y7: Nơi cấp | Z7: Hộ khẩu thường trú hoặc tạm trú | AA7: SỐ PHÁT SINH | AG7: SỐ THÁNG | AH7: ĐIỀU CHỈNH SỐ PHẢI ĐÓNG | AY7: Số Tháng Truy Thu | AZ7: Lãi Truy Thu
J9: Tiền lương | K9: Phụ cấp | N9: Tiền lương | O9: Phụ cấp | AA9: BHYT | AC9: BHTN | AE9: BHXH | AH9: BHYT | AJ9: BHTN | AL9: BHXH | AZ9: BHXH | BA9: BHYT | BB9: BHTN
F10: Tỉnh | G10: Bệnh Viện | K10: CV | L10: TNVK % | M10: TN nghề % | O10: CV | P10: TNVK % | Q10: TN nghề % | AA10: TĂNG | AB10: GIẢM | AC10: TĂNG | AD10: GIẢM | AE10: TĂNG | AF10: GIẢM | AH10: TĂNG | AI10: GIẢM | AJ10: TĂNG | AK10: GIẢM | AL10: TĂNG | AM10: GIẢM
A11: 1 | B11: 2 | C11: =B11+1 -> 3 | D11: =C11+1 -> 4 | E11: =D11+1 -> 5 | F11: =E11+1 -> 6 | G11: =F11+1 -> 7 | H11: =G11+1 -> 8 | I11: =H11+1 -> 9 | J11: =I11+1 -> 10 | K11: =J11+1 -> 11 | L11: =K11+1 -> 12 | M11: =L11+1 -> 13 | N11: =M11+1 -> 14 | O11: =N11+1 -> 15 | P11: =O11+1 -> 16 | Q11: =P11+1 -> 17 | R11: =Q11+1 -> 18 | S11: =R11+1 -> 19 | T11: =S11+1 -> 20 | U11: =T11+1 -> 21 | V11: =U11+1 -> 22 | W11: =V11+1 -> 23 | X11: =W11+1 -> 24 | Y11: =X11+1 -> 25 | Z11: =Y11+1 -> 26
A12: <%=atype[j]%> | B12: <%=cur_type%> | AA12: =IF(AND(AO12=$AA$4,OR(T12=28.5%,T12=30.5%)),IF(AR12>AQ12,AR12-AQ12,0),0) -> 0 | AB12: =IF(AND(AO12=$AA$4,OR(T12=28.5%,T12=30.5%)),IF(AQ12>AR12,AQ12-AR12,0),0) -> 0 | AC12: =IF(AND(AO12=$AA$4,OR(T12=2%,T12=30.5%)),IF(AR12>AQ12,AR12-AQ12,0),0) -> 0 | AD12: =IF(AND(AO12=$AA$4,OR(T12=2%,T12=30.5%)),IF(AQ12>AR12,AQ12-AR12,0),0) -> 0 | AE12: =IF(AND(AO12=$AA$4,OR(T12=24%,OR(T12=28.5%,OR(T12=28.5%,T12=30.5%)))),IF(AR12>AQ12,AR12-AQ12,0),0) -> 0 | AF12: =IF(AND(AO12=$AA$4,OR(T12=22%,OR(T12=24%,OR(T12=26.5%,T12=28.5%)))),IF(AQ12>AR12,AQ12-AR12,0),0) -> 0 | AG12: =IF(OR((AO12<>$AA$4),(AND((T12=4.5%),(AN12=AO12)))),DATEDIF(AN12,AO12,"m")+1,DATEDIF(AN12,AO12,"m")) -> 0 | AH12: =IF(OR(T12=4.5%,OR(T12=28.5%,T12=30.5%,T12=26.5%)),AG12*MAX((AR12-AQ12),0)*4.5%,0) -> 0 | AI12: =IF(OR(T12=4.5%,OR(T12=28.5%,T12=30.5%,T12=26.5%)),AG12*MAX(AQ12-AR12,0)*4.5%,0) -> 0 | AJ12: =IF(OR(T12=2%,T12=30.5%,AND((T12=28.5%),YEAR(AO12)<2012)),AG12*MAX((AR12-AQ12),0)*2%,0) -> 0 | AK12: =IF(OR(T12=2%,T12=30.5%, AND((T12=28.5%),YEAR(AO12)<2012)),AG12*MAX(AQ12-AR12,0)*2%,0) -> 0 | AL12: =IF(OR(T12=24%,OR(T12=28.5%,T12=30.5%,T12=26.5%)),IF(YEAR(AN12)=2011,AG12*MAX((AR12-AQ12),0)*22%,AG12*MAX((AR12-AQ12),0)*24%),0) -> 0 | AM12: =IF(OR(T12=24%,T12=26%,OR(T12=28.5%,T12=30.5%,T12=26.5%)),IF(YEAR(AN12)=2011,AG12*MAX(AQ12-AR12,0)*22%,AG12*MAX(AQ12-AR12,0)*24%),0) -> 0 | AN12: =IF(R12<>"",R12,$AA$4) -> 40909 | AO12: =IF(S12<>"",S12,$AA$4) -> 40909 | AP12: =DATE(YEAR($AA$4),MONTH($AA$4)-1,DAY($AA$4)) -> 40878 | AQ12: =IF(J12>$AB$4,$AB$4,J12) -> 0 | AR12: =IF(N12>$AB$4,$AB$4,N12) -> 0 | AS12: =IF(AND(AB12>0,AR12=0),1,0) -> 0 | AT12: =IF(AND(AF12>0,AR12=0),1,0) -> 0 | AU12: =IF(AND(AD12>0,AR12=0),1,0) -> 0 | AV12: =IF(AND(AA12>0,AQ12=0),1,0) -> 0 | AW12: =IF(AND((AE12>0),(AQ12=0)),1,0) -> 0 | AX12: =IF(AND((AC12>0),(AQ12=0)),1,0) -> 0 | AY12: =IF(OR(T12=4.5%,AN12>AP12),0,(DATEDIF(AN12,AP12,"m"))+1) -> 0 | AZ12: =IF(OR(T12=4.5%,T12=2%,AY12=1,AQ12>AR12),0,IF(YEAR(AN12)<2010,laitt(AG12,AY12,MAX(AR12-AQ12)*20%,0.875%),IF(YEAR(AN12)<2012,laitt(AG12,AY12,MAX(AR12-AQ12)*22%,0.875%),laitt(AG12,AY12,MAX(AR12-AQ12)*24%,0.875%)))) -> 0 | BA12: =IF(OR(AND(YEAR(AN12)<=2009,T12=20%),AND(YEAR(AN12)<2010,T12=22%),AND(YEAR(AN12)<2012,T12=24%),R12=26%,AQ12>AR12,T12=4.5%,AY12=1),0,IF(YEAR(AN12)<2010,laitt(AG12,AY12,(AR12-AQ12)*3%,0.75%),laitt(AG12,AY12,(AR12-AQ12)*4.5%,0.75%))) -> 0 | BB12: =IF(OR(YEAR(AN12)<2009,AND(YEAR(AN12)>=2010,T12=26.5%),AND(YEAR(AN12)>2012,T12=28.5%),T12=4.5%,AQ12>AR12,AY12=1),0,laitt(AG12,AY12,(AR12-AQ12)*2%,0.875%)) -> 0
A13: <%=atype[j]%>.<%= btype[k]%> | B13: <%= cur_kind %> | AA13: =IF(AND(AO13=$AA$4,OR(T13=28.5%,T13=30.5%)),IF(AR13>AQ13,AR13-AQ13,0),0) -> 0 | AB13: =IF(AND(AO13=$AA$4,OR(T13=28.5%,T13=30.5%)),IF(AQ13>AR13,AQ13-AR13,0),0) -> 0 | AC13: =IF(AND(AO13=$AA$4,OR(T13=2%,T13=30.5%)),IF(AR13>AQ13,AR13-AQ13,0),0) -> 0 | AD13: =IF(AND(AO13=$AA$4,OR(T13=2%,T13=30.5%)),IF(AQ13>AR13,AQ13-AR13,0),0) -> 0 | AE13: =IF(AND(AO13=$AA$4,OR(T13=24%,OR(T13=28.5%,OR(T13=28.5%,T13=30.5%)))),IF(AR13>AQ13,AR13-AQ13,0),0) -> 0 | AF13: =IF(AND(AO13=$AA$4,OR(T13=22%,OR(T13=24%,OR(T13=26.5%,T13=28.5%)))),IF(AQ13>AR13,AQ13-AR13,0),0) -> 0 | AG13: =IF(OR((AO13<>$AA$4),(AND((T13=4.5%),(AN13=AO13)))),DATEDIF(AN13,AO13,"m")+1,DATEDIF(AN13,AO13,"m")) -> 0 | AH13: =IF(OR(T13=4.5%,OR(T13=28.5%,T13=30.5%,T13=26.5%)),AG13*MAX((AR13-AQ13),0)*4.5%,0) -> 0 | AI13: =IF(OR(T13=4.5%,OR(T13=28.5%,T13=30.5%,T13=26.5%)),AG13*MAX(AQ13-AR13,0)*4.5%,0) -> 0 | AJ13: =IF(OR(T13=2%,T13=30.5%,AND((T13=28.5%),YEAR(AO13)<2012)),AG13*MAX((AR13-AQ13),0)*2%,0) -> 0 | AK13: =IF(OR(T13=2%,T13=30.5%, AND((T13=28.5%),YEAR(AO13)<2012)),AG13*MAX(AQ13-AR13,0)*2%,0) -> 0 | AL13: =IF(OR(T13=24%,OR(T13=28.5%,T13=30.5%,T13=26.5%)),IF(YEAR(AN13)=2011,AG13*MAX((AR13-AQ13),0)*22%,AG13*MAX((AR13-AQ13),0)*24%),0) -> 0 | AM13: =IF(OR(T13=24%,T13=26%,OR(T13=28.5%,T13=30.5%,T13=26.5%)),IF(YEAR(AN13)=2011,AG13*MAX(AQ13-AR13,0)*22%,AG13*MAX(AQ13-AR13,0)*24%),0) -> 0 | AN13: =IF(R13<>"",R13,$AA$4) -> 40909 | AO13: =IF(S13<>"",S13,$AA$4) -> 40909 | AP13: =DATE(YEAR($AA$4),MONTH($AA$4)-1,DAY($AA$4)) -> 40878 | AQ13: =IF(J13>$AB$4,$AB$4,J13) -> 0 | AR13: =IF(N13>$AB$4,$AB$4,N13) -> 0 | AS13: =IF(AND(AB13>0,AR13=0),1,0) -> 0 | AT13: =IF(AND(AF13>0,AR13=0),1,0) -> 0 | AU13: =IF(AND(AD13>0,AR13=0),1,0) -> 0 | AV13: =IF(AND(AA13>0,AQ13=0),1,0) -> 0 | AW13: =IF(AND((AE13>0),(AQ13=0)),1,0) -> 0 | AX13: =IF(AND((AC13>0),(AQ13=0)),1,0) -> 0 | AY13: =IF(OR(T13=4.5%,AN13>AP13),0,(DATEDIF(AN13,AP13,"m"))+1) -> 0 | AZ13: =IF(OR(T13=4.5%,T13=2%,AY13=1,AQ13>AR13),0,IF(YEAR(AN13)<2010,laitt(AG13,AY13,MAX(AR13-AQ13)*20%,0.875%),IF(YEAR(AN13)<2012,laitt(AG13,AY13,MAX(AR13-AQ13)*22%,0.875%),laitt(AG13,AY13,MAX(AR13-AQ13)*24%,0.875%)))) -> 0 | BA13: =IF(OR(AND(YEAR(AN13)<=2009,T13=20%),AND(YEAR(AN13)<2010,T13=22%),AND(YEAR(AN13)<2012,T13=24%),R13=26%,AQ13>AR13,T13=4.5%,AY13=1),0,IF(YEAR(AN13)<2010,laitt(AG13,AY13,(AR13-AQ13)*3%,0.75%),laitt(AG13,AY13,(AR13-AQ13)*4.5%,0.75%))) -> 0 | BB13: =IF(OR(YEAR(AN13)<2009,AND(YEAR(AN13)>=2010,T13=26.5%),AND(YEAR(AN13)>2012,T13=28.5%),T13=4.5%,AQ13>AR13,AY13=1),0,laitt(AG13,AY13,(AR13-AQ13)*2%,0.875%)) -> 0
A14: <%=ctype[g]%> | B14: <%= cur_group%> | AL14: =IF(OR(T14=24%,OR(T14=28.5%,T14=30.5%,T14=26.5%)),IF(YEAR(AN14)=2011,AG14*MAX((AR14-AQ14),0)*22%,AG14*MAX((AR14-AQ14),0)*24%),0) -> 0 | AM14: =IF(OR(T14=24%,T14=26%,OR(T14=28.5%,T14=30.5%,T14=26.5%)),IF(YEAR(AN14)=2011,AG14*MAX(AQ14-AR14,0)*22%,AG14*MAX(AQ14-AR14,0)*24%),0) -> 0 | AY14: =IF(OR(T14=4.5%,AN14>AP14),0,(DATEDIF(AN14,AP14,"m"))+1) -> 1 | AZ14: =IF(OR(T14=4.5%,T14=2%,AY14=1,AQ14>AR14),0,IF(YEAR(AN14)<2010,laitt(AG14,AY14,MAX(AR14-AQ14)*20%,0.875%),IF(YEAR(AN14)<2012,laitt(AG14,AY14,MAX(AR14-AQ14)*22%,0.875%),laitt(AG14,AY14,MAX(AR14-AQ14)*24%,0.875%)))) -> 0 | BA14: =IF(OR(AND(YEAR(AN14)<=2009,T14=20%),AND(YEAR(AN14)<2010,T14=22%),AND(YEAR(AN14)<2012,T14=24%),R14=26%,AQ14>AR14,T14=4.5%,AY14=1),0,IF(YEAR(AN14)<2010,laitt(AG14,AY14,(AR14-AQ14)*3%,0.75%),laitt(AG14,AY14,(AR14-AQ14)*4.5%,0.75%))) -> 0 | BB14: =IF(OR(YEAR(AN14)<2009,AND(YEAR(AN14)>=2010,T14=26.5%),AND(YEAR(AN14)>2012,T14=28.5%),T14=4.5%,AQ14>AR14,AY14=1),0,laitt(AG14,AY14,(AR14-AQ14)*2%,0.875%)) -> 0
A15: <%=count %> | B15: <%=dt_Emp.Rows[i][3].ToString() %> | C15: <%=dt_Emp.Rows[i][4].ToString() %> | D15: <%=dt_Emp.Rows[i][38].ToString() %> | E15: <%=dt_Emp.Rows[i][40].ToString() %> | F15: <%=dt_Emp.Rows[i][43].ToString() %> | G15: <%=dt_Emp.Rows[i][44].ToString() %> | H15: <%=dt_Emp.Rows[i][45].ToString() %> | I15: <%=dt_Emp.Rows[i][41].ToString() %> | J15: <%=dt_Emp.Rows[i][5].ToString() %> | N15: <%=dt_Emp.Rows[i][10].ToString() %> | R15: <%=dt_Emp.Rows[i][19].ToString() %> | S15: =DATE(<%= dt_Emp.Rows[i][19].ToString().Substring(2,4).ToString() %>,<%= dt_Emp.Rows[i][19].ToString().Substring(0,2).ToString() %>,1) ->  | T15: =DATE(<%= dt_Emp.Rows[i][20].ToString().Substring(2,4).ToString() %>,<%= dt_Emp.Rows[i][20].ToString().Substring(0,2).ToString() %>,1) ->  | U15: <%=dt_Emp.Rows[i][21].ToString() %> | V15: <%=dt_Emp.Rows[i][42].ToString() %> | AB15: =IF(AND(AO<%= row+14 %>=$AA$4,OR(T<%= row+14 %>=28.5%,T<%= row+14 %>=30.5%)),IF(AR<%= row+14 %>>AQ<%= row+14 %>,AR<%= row+14 %>-AQ<%= row+14 %>,0),0) ->  | AC15: =IF(AND(AO<%= row+14 %>=$AA$4,OR(T<%= row+14 %>=28.5%,T<%= row+14 %>=30.5%)),IF(AQ<%= row+14 %>>AR<%= row+14 %>,AQ<%= row+14 %>-AR<%= row+14 %>,0),0) ->  | AD15: =IF(AND(AO<%= row+14 %>=$AA$4,OR(T<%= row+14 %>=2%,T<%= row+14 %>=30.5%)),IF(AR<%= row+14 %>>AQ<%= row+14 %>,AR<%= row+14 %>-AQ<%= row+14 %>,0),0) ->  | AE15: =IF(AND(AO<%= row+14 %>=$AA$4,OR(T<%= row+14 %>=2%,T<%= row+14 %>=30.5%)),IF(AQ<%= row+14 %>>AR<%= row+14 %>,AQ<%= row+14 %>-AR<%= row+14 %>,0),0) ->  | AF15: =IF(AND(AO<%= row+14 %>=$AA$4,OR(T<%= row+14 %>=24%,OR(T<%= row+14 %>=28.5%,OR(T<%= row+14 %>=28.5%,T<%= row+14 %>=30.5%)))),IF(AR<%= row+14 %>>AQ<%= row+14 %>,AR<%= row+14 %>-AQ<%= row+14 %>,0),0) ->  | AG15: =IF(AND(AO<%= row+14 %>=$AA$4,OR(T<%= row+14 %>=24%,OR(T<%= row+14 %>=26%,OR(T<%= row+14 %>=28.5%,T<%= row+14 %>=30.5%)))),IF(AQ<%= row+14 %>>AR<%= row+14 %>,AQ<%= row+14 %>-AR<%= row+14 %>,0),0) ->  | AH15: =IF(OR((AO<%= row+14 %><>$AA$4),(AND((T<%= row+14 %>=4.5%),(AN<%= row+14 %>=AO<%= row+14 %>)))),DATEDIF(AN<%= row+14 %>,AO<%= row+14 %>,"m")+1,DATEDIF(AN<%= row+14 %>,AO<%= row+14 %>,"m")) ->  | AI15: =IF(OR(T<%= row+14 %>=4.5%,OR(T<%= row+14 %>=28.5%,T<%= row+14 %>=30.5%,T<%= row+14 %>=26.5%)),AG<%= row+14 %>*MAX((AR<%= row+14 %>-AQ<%= row+14 %>),0)*4.5%,0) ->  | AJ15: =IF(OR(T<%= row+14 %>=4.5%,OR(T<%= row+14 %>=28.5%,T<%= row+14 %>=30.5%,T<%= row+14 %>=26.5%)),AG<%= row+14 %>*MAX(AQ<%= row+14 %>-AR<%= row+14 %>,0)*4.5%,0) ->  | AK15: =IF(OR(T<%= row+14 %>=2%,T<%= row+14 %>=30.5%,AND((T<%= row+14 %>=28.5%),YEAR(AO<%= row+14 %>)<2012)),AG<%= row+14 %>*MAX((AR<%= row+14 %>-AQ<%= row+14 %>),0)*2%,0) ->  | AL15: =IF(OR(T<%= row+14 %>=2%,T<%= row+14 %>=30.5%, AND((T<%= row+14 %>=28.5%),YEAR(AO<%= row+14 %>)<2012)),AG<%= row+14 %>*MAX(AQ<%= row+14 %>-AR<%= row+14 %>,0)*2%,0) ->  | AM15: =IF(OR(T<%= row+14 %>=24%,OR(T<%= row+14 %>=28.5%,T<%= row+14 %>=30.5%,T<%= row+14 %>=26.5%)),IF(YEAR(AN<%= row+14 %>)=2011,AG<%= row+14 %>*MAX((AR<%= row+14 %>-AQ<%= row+14 %>),0)*22%,AG<%= row+14 %>*MAX((AR<%= row+14 %>-AQ<%= row+14 %>),0)*24%),0) ->  | AN15: =IF(OR(T<%= row+14 %>=24%,T<%= row+14 %>=26%,OR(T<%= row+14 %>=28.5%,T<%= row+14 %>=30.5%,T<%= row+14 %>=26.5%)),IF(YEAR(AN<%= row+14 %>)=2011,AG<%= row+14 %>*MAX(AQ<%= row+14 %>-AR<%= row+14 %>,0)*22%,AG<%= row+14 %>*MAX(AQ<%= row+14 %>-AR<%= row+14 %>,0)*24%),0) ->  | AO15: =IF(R<%= row+14 %><>"",R<%= row+14 %>,$AA$4) ->  | AP15: =IF(S<%= row+14 %><>"",S<%= row+14 %>,$AA$4) ->  | AQ15: =DATE(YEAR($AA$4),MONTH($AA$4)-1,DAY($AA$4)) ->  | AR15: =IF(J<%= row+14 %>>$AB$4,$AB$4,J<%= row+14 %>) ->  | AS15: =IF(N<%= row+14 %>>$AB$4,$AB$4,N<%= row+14 %>) ->  | AT15: =IF(AND(AB<%= row+14 %>>0,AR<%= row+14 %>=0),1,0) ->  | AU15: =IF(AND(AF<%= row+14 %>>0,AR<%= row+14 %>=0),1,0) ->  | AV15: =IF(AND(AD<%= row+14 %>>0,AR<%= row+14 %>=0),1,0) ->  | AW15: =IF(AND(AA<%= row+14 %>>0,AQ<%= row+14 %>=0),1,0) ->  | AX15: =IF(AND((AE<%= row+14 %>>0),(AQ<%= row+14 %>=0)),1,0) ->  | AY15: =IF(AND((AC<%= row+14 %>>0),(AQ<%= row+14 %>=0)),1,0) ->  | AZ15: =IF(OR(T<%= row+14 %>=4.5%,AN<%= row+14 %>>AP<%= row+14 %>),0,(DATEDIF(AN<%= row+14 %>,AP<%= row+14 %>,"m"))+1) ->  | BA15: =IF(OR(T<%= row+14 %>=4.5%,T<%= row+14 %>=2%,AY<%= row+14 %>=1,AQ<%= row+14 %>>AR<%= row+14 %>),0,IF(YEAR(AN<%= row+14 %>)<2010,laitt(AG<%= row+14 %>,AY<%= row+14 %>,MAX(AR<%= row+14 %>-AQ<%= row+14 %>)*20%,0.875%),IF(YEAR(AN<%= row+14 %>)<2012,laitt(AG<%= row+14 %>,AY<%= row+14 %>,MAX(AR<%= row+14 %>-AQ<%= row+14 %>)*22%,0.875%),laitt(AG<%= row+14 %>,AY<%= row+14 %>,MAX(AR<%= row+14 %>-AQ<%= row+14 %>)*24%,0.875%)))) ->  | BB15: =IF(OR(AND(YEAR(AN<%= row+14 %>)<=2009,T<%= row+14 %>=20%),AND(YEAR(AN<%= row+14 %>)<2010,T<%= row+14 %>=22%),AND(YEAR(AN<%= row+14 %>)<2012,T<%= row+14 %>=24%),R<%= row+14 %>=26%,AQ<%= row+14 %>>AR<%= row+14 %>,T<%= row+14 %>=4.5%,AY<%= row+14 %>=1),0,IF(YEAR(AN<%= row+14 %>)<2010,laitt(AG<%= row+14 %>,AY<%= row+14 %>,(AR<%= row+14 %>-AQ<%= row+14 %>)*3%,0.75%),laitt(AG<%= row+14 %>,AY<%= row+14 %>,(AR<%= row+14 %>-AQ<%= row+14 %>)*4.5%,0.75%))) ->  | BC15: =IF(OR(YEAR(AN<%= row+14 %>)<2009,AND(YEAR(AN<%= row+14 %>)>=2010,T<%= row+14 %>=26.5%),AND(YEAR(AN<%= row+14 %>)>2012,T<%= row+14 %>=28.5%),T<%= row+14 %>=4.5%,AQ<%= row+14 %>>AR<%= row+14 %>,AY<%= row+14 %>=1),0,laitt(AG<%= row+14 %>,AY<%= row+14 %>,(AR<%= row+14 %>-AQ<%= row+14 %>)*2%,0.875%)) ->  | BD15: <%=dt_Emp.Rows[i][29].ToString() %>
AA16: =SUM(AA12:AA<%= row+14 %>) ->  | AB16: =SUM(AB12:AB<%= row+14 %>) ->  | AC16: =SUM(AC12:AC<%= row+14 %>) ->  | AD16: =SUM(AD12:AD<%= row+14 %>) ->  | AE16: =SUM(AE12:AE<%= row+14 %>) ->  | AF16: =SUM(AF12:AF<%= row+14 %>) ->  | AH16: =SUM(AH12:AH<%= row+14 %>) ->  | AI16: =SUM(AI12:AI<%= row+14 %>) ->  | AJ16: =SUM(AJ12:AJ<%= row+14 %>) ->  | AK16: =SUM(AK12:AK<%= row+14 %>) ->  | AL16: =SUM(AL12:AL<%= row+14 %>) ->  | AM16: =SUM(AM12:AM<%= row+14 %>) ->  | AS16: =SUM(AS12:AS<%= row+14 %>) ->  | AT16: =SUM(AT12:AT<%= row+14 %>) ->  | AU16: =SUM(AU12:AU<%= row+14 %>) ->  | AV16: =SUM(AV12:AV<%= row+14 %>) ->  | AW16: =SUM(AW12:AW<%= row+14 %>) ->  | AX16: =SUM(AX12:AX<%= row+14 %>) ->  | AZ16: =SUM(AZ12:AZ<%= row+14 %>) ->  | BA16: =SUM(BA12:BA<%= row+14 %>) ->  | BB16: =SUM(BB12:BB<%= row+14 %>) -> 
A18: B. PPHẦN TỔNG HỢP CHUNG
B19: Phát sinh | D19: Bảo hiểm y tế | K19: Bảo hiểm thất nghiệp | S19: Bảo hiểm xã hội
D20: Tăng | H20: Giảm | K20: Tăng | O20: Giảm | S20: Tăng | T20: Giảm
B21: 1.Số lao động | D21: =AV<%= row+15 %> ->  | H21: =AT<%= row+15 %> ->  | K21: =AX<%= row+15 %> ->  | O21: =AU<%= row+15 %> ->  | S21: =AW<%= row+15 %> ->  | T21: =AT<%= row+15 %> -> 
B22: 2.Quỹ lương | D22: =AA<%= row+15 %> ->  | H22: =AB<%= row+15 %> ->  | K22: =AC<%= row+15 %> ->  | O22: =AD<%= row+15 %> ->  | S22: =AE<%= row+15 %> ->  | T22: =AF<%= row+15 %> -> 
B23: 3.Số phải đóng | D23: =D<%= row+21 %>*4.5% ->  | H23: =H<%= row+21 %>*4.5% ->  | K23: =K<%= row+21 %>*2% ->  | O23: =O<%= row+21 %>*2% ->  | S23: =S<%= row+21 %>*24% ->  | T23: =T<%= row+21 %>*24% -> 
B24: 4.Điều chỉnh số phải đóng | D24: =AH<%= row+15 %>+BA<%= row+15 %> ->  | H24: =AI<%= row+15 %> ->  | K24: =AJ<%= row+15 %>+BB<%= row+15 %> ->  | O24: =AK<%= row+15 %> ->  | S24: =AL<%= row+15 %>+AZ<%= row+15 %> ->  | T24: =AM<%= row+15 %> -> 
A25: Phần CQ BHXH ghi: | L25: Phần đơn vị ghi:
B26: Tổng số tờ khai:
B27: Tồng số sổ BHXH đề nghị cấp:
B28: Tổng số thẻ BHYT đề nghị cấp: | I28: Thời hạn từ……. đến……………… | L28: Tồng số thẻ BHYT đề nghị cấp: | T28: Thời hạn từ……. đến………………
S29: Ngày <%= DateTime.Now.Day.ToString() %> tháng <%= DateTime.Now.Month.ToString() %> năm <%= DateTime.Now.Year.ToString() %>
B30: Cán bộ thụ | F30: Cán bộ sổ, thẻ | M30: Người lập biểu | S30: Thủ trưởng đơn vị

A1: DANH SÁCH LAO ĐỘNG THAM GIA BẢO HIỂM XÃ HỘI, BẢO HIỂM Y TẾ