A1: Tên đơn vị: | B1: CTY TNHH SUNG SHIN A (VN) | D1: DANH SÁCH LAO ĐỘNG THAM GIA BHXH, BHYT,BHTN
A2: Mã đơn vị: | B2: YN 1258 Z | G2: Số: 01 | K2: ="Tháng     "&MONTH(Z3)&"     năm     "&YEAR(Z3) -> Tháng 10 năm 2011 | Z2: Tháng B.Cáo | AA2: Trần 2009 | AB2: Trần 2010 | AC2: Trần 2011 | AD2: Tối thiểu chung
A3: Địa chỉ: | B3: Đường NA1,-KCN Mỹ Phước II-Bến Cát- Bình Dương | Z3: =DATE(<%=int.Parse(p_rpt_month.Substring(0,4))%>,<%=int.Parse(p_rpt_month.Substring(4,2))%>,<%=1%>) ->  | AA3: 13000000 | AB3: 14600000 | AC3: 16600000 | AD3: 830000
A4: Điện thọai: | B4: 06503.565798 | C4: Fax :06503.559862
A6: Số TT | B6: Họ và tên | C6: Số sổ BHXH | D6: Ngày, tháng, năm sinh | E6: Nữ (X) | F6: Số chứng minh thư | K6: Địa chỉ | L6: Nơi đăng ký KCB ban đầu | N6: Chức vụ hoặc chức danh nghề | O6: Tiền lương, tiền công | P6: Phụ cấp | T6: Đóng BH TN (X) | U6: Đóng từ tháng năm | V6: Quyết định hoặc HĐLĐ, HĐLV. | Y6: Ghi chú | Z6: SỐ PHÁT SINH | AC6: SỐ PHẢI ĐÓNG BỔ SUNG
G7: Ngày cấp | H7: Nơi cấp | I7: Dân tộc | J7: Nguyên quán | P7: Chức vụ | Q7: Thâm niên VK | R7: Thâm niên nghề | S7: Khu vực | V7: Số | W7: Ngày, tháng, năm | X7: Loại | AC7: Tháng | AD7: BHXH | AE7: BHYT | AF7: BHTN
L8: Tỉnh | M8: Bệnh viện | Z8: BHXH | AA8: BHYT | AB8: BHTN
A9: 1 | B9: 2 | C9: 3 | D9: 4 | E9: 5 | F9: 6 | K9: 7 | L9: 8 | M9: 9 | N9: 10 | O9: 11 | P9: 12 | Q9: 13 | R9: 14 | S9: 15 | T9: 16 | U9: 17 | V9: 18 | W9: 19 | X9: 20 | Y9: 21 | Z9: A | AA9: B | AB9: C | AC9: D | AD9: E | AE9: F | AF9: G
B10: MỨC LƯƠNG
A11: <%=i+1 %> | B11: <%=dt_Emp.Rows[i][0].ToString()%> | C11: <%=dt_Emp.Rows[i][1].ToString()%> | D11: <%=dt_Emp.Rows[i][2].ToString()%> | E11: <%=dt_Emp.Rows[i][3].ToString()%> | F11: <%=dt_Emp.Rows[i][4].ToString()%> | G11: <%=dt_Emp.Rows[i][5].ToString()%> | H11: <%=dt_Emp.Rows[i][6].ToString()%> | I11: <%=dt_Emp.Rows[i][7].ToString()%> | J11: <%=dt_Emp.Rows[i][8].ToString()%> | K11: <%=dt_Emp.Rows[i][9].ToString()%> | L11: <%=dt_Emp.Rows[i][10].ToString()%> | M11: <%=dt_Emp.Rows[i][11].ToString()%> | N11: <%=dt_Emp.Rows[i][12].ToString()%> | O11: <%=dt_Emp.Rows[i][13].ToString()%> | P11: <%=dt_Emp.Rows[i][14].ToString()%> | Q11: <%=dt_Emp.Rows[i][15].ToString()%> | R11: <%=dt_Emp.Rows[i][16].ToString()%> | S11: <%=dt_Emp.Rows[i][17].ToString()%> | T11: <%=dt_Emp.Rows[i][18].ToString()%> | U11: =DATE(<%=int.Parse(dt_Emp.Rows[i][19].ToString().Substring(3,4).ToString())%>,<%=int.Parse(dt_Emp.Rows[i][19].ToString().Substring(0,2).ToString())%>,<%=1%>) ->  | V11: Số HĐ ,ngày <%=dt_Emp.Rows[i][20].ToString()%> | W11: <%=dt_Emp.Rows[i][21].ToString()%> | X11: <%=dt_Emp.Rows[i][22].ToString()%> | Z11: =IF(O<%=seq_row %>>$AA$3,$AA$3,O<%=seq_row %>) -> 2,145,000 | AA11: =Z<%=seq_row %> -> 2,145,000 | AB11: =IF(T<%=seq_row %>="X",Z<%=seq_row %>,0) -> 2,145,000 | AC11: =IF(MONTH(AH<%=seq_row %>)<MONTH(AG<%=seq_row %>),(((MONTH(AH<%=seq_row %>)+12)-MONTH(AG<%=seq_row %>))+((YEAR(AH<%=seq_row %>)-1)-YEAR(AG<%=seq_row %>))*12),IF(YEAR(AH<%=seq_row %>)=YEAR(AG<%=seq_row %>),(MONTH(AH<%=seq_row %>)-MONTH(AG<%=seq_row %>)),(((YEAR(AH<%=seq_row %>)-YEAR(AG<%=seq_row %>))*12)+(MONTH(AH<%=seq_row %>)-MONTH(AG<%=seq_row %>))))) -> 0 | AD11: =Z<%=seq_row %>*22%*AC<%=seq_row %> -> 0 | AE11: =AA<%=seq_row %>*AC<%=seq_row %>*4.5% -> 0 | AF11: =IF(YEAR(U<%=seq_row %>)=2008,AB<%=seq_row %>*2%*(AC<%=seq_row %>-(12-MONTH(U<%=seq_row %>)+1)),AB<%=seq_row %>*2%*AC<%=seq_row %>) -> 0 | AG11: =IF(U<%=seq_row %>="",$Z$3,U<%=seq_row %>) -> 01/10/2011 | AH11: =$Z$3 -> 01/10/2011 | AI11: <%=dt_Emp.Rows[i][23].ToString()%>
Z13: =SUM(Z<%=st_row %>:Z<%=et_row %>) -> 173,745,000 | AA13: =SUM(AA<%=st_row %>:AA<%=et_row %>) -> 173,745,000 | AB13: =SUM(AB<%=st_row %>:AB<%=et_row %>) -> 173,745,000 | AD13: =SUM(AD<%=st_row %>:AD<%=et_row %>) -> 0 | AE13: =SUM(AE<%=st_row %>:AE<%=et_row %>) -> 0 | AF13: =SUM(AF<%=st_row %>:AF<%=et_row %>) -> 0
M14: TỔNG HỢP CHUNG
M15: Phát sinh tăng | P15: BHXH | S15: BHYT | V15: BHTN | AC15: Gỉai thích | AD15: Số điều chỉnh tăng BHXH 191.774.440 là:
M16: 1. Số lao động: | P16: =COUNTIF(O<%=st_row %>:O<%=et_row %>,">0") -> 81 | S16: =COUNTIF(O<%=st_row %>:O<%=et_row %>,">0") -> 81 | V16: =COUNTIF(T<%=st_row %>:T<%=et_row %>,"X") -> 81 | AD16: Tăng lùi từ t8 đến t11 là 49 lđ (tổng lương của 49 nguoi nay la: 71.380.000) TRUY BHXH T8 =71.380.000 * 4(tháng) * 22% (ty le thu cua BHXH)= 62.814.400
M17: 2. Quỹ lương tham gia | P17: =SUM(Z<%=st_row %>:Z<%=et_row %>) -> 173,745,000 | S17: =SUM(AA<%=st_row %>:AA<%=et_row %>) -> 173,745,000 | V17: =SUM(AB<%=st_row %>:AB<%=et_row %>) -> 173,745,000 | AD17: Tăng lùi từ T9 đến t11 là 37 lđ (tổng lương của 37 nguoi nay la: 47.840.000) TRUY BHXH T9 =47.840.000 * 3(tháng) * 22% (ty le thu cua BHXH)= 31.574.400
M18: 3. Số phải đóng | P18: =22%*P<%=et_row +6 %> -> 38,223,900 | S18: =4.5%*S<%=et_row +6 %> -> 7,818,525 | V18: =2%*V<%=et_row + 6%> -> 3,474,900 | AD18: Tăng lùi từ T10 đến t11 là 107 lđ (tổng lương của 107 nguoi nay la: 137.600.000) TRUY BHXH T10 =137.600.000 * 2(tháng) * 22% (ty le thu cua BHXH)= 60.544.000
M19: Trong đó: Số tiên để lại đơn vị | P19: =P<%=et_row +6%>*2% -> 3,474,900 | AD19: Tăng lùi từ T11 đến t11 là 100 lđ (tổng lương của 100 nguoi nay la: 167.462.000) TRUY BHXH T11 =167.462.000 * 1(tháng) * 22% (ty le thu cua BHXH)= 36.841.640
M20: 4. Số tiền điều chỉnh: | P20: =AD<%=et_row + 2%> -> 0 | S20: =AE<%=et_row + 2%> -> 0 | V20: =AF<%=et_row + 2%> -> 0 | AD20: Tương tự như vậy H nhân lên và tính cho phần BHYT, BHTN
F21: Ngày..... tháng...... năm.......... | Q21: Ngày 01 tháng 10 năm 2011
B22: Cán bộ thu | F22: GIÁM ĐỐC BHXH | M22: Người lập biểu | S22: Người sử dụng lao động
A25: Ghi chuù: Maãu soá 02a-TBH do Ñôn vò laäp khi coù lao ñoäng taêng môùi so vôùi thaùng tröôùc, hoaëc laäp danh saùch toaøn boä lao ñoäng khi ñôn vò môùi tham gia BHXH, BHYT, BHTN
A27: Phöông phaùp ghi:
B28: Caùc oâ coù maøu Xanh laø oâ coâng thöùc
B29: Nhaäp ngaøy, thaùng, naêm vaøo Coät R (oâ maøu vaøng ñeå coù thaùng baùo caùo)
B30: Coät 1, 2: ghi soá TT, hoï teân ngöôøi lao ñoäng taêng
B31: Coät 3: ghi soá soå BHXH cuûa ngöôøi lao ñoäng (neáu coù). Ngöôøi lao ñoäng ñaõ coù soå ghi tröôùc, chöa coù soå BHXH ghi sau.
B32: Coät 4: ghi soá theû BHYT (neáu coù), chöa coù boå sung sau khi cô quan BHXH caáp.
B33: Coät 5: ghi ngaøy thaùng naêm sinh (yeâu caàu caàn phaûi ghi ñaày ñuû caû ngaøy, thaùng sinh)
B34: Coät 6: neáu laø nöõ ñaùnh daáu x
B35: Coät 7: ghi soá CMND cuûa ngöôøi lao ñoäng.
B36: Coät 8: ghi ñòa chæ laø nôi cö truù hieän taïi cuûa ngöôøi lao ñoäng.
B37: Coät 9, 10: ghi nôi ñaêng kyù KCB ban ñaàu.
B38: Coät 11: ghi toång möùc tieàn löông, tieàn coâng theo HÑLÑ
B39: - Neáu ñôn vò thöïc hieän theo thang, baûng löông Nhaø nöôùc thì ghi baèng heä soá löông.
B40: - Neáu ñôn vò thöïc hieän thang, baûng löông do ñôn vò töï xaây döïng thì ghi baèng toång möùc löông tieàn ñoàng.
B41: - Neáu ghi baèng USD: thì tính ra VNÑ ñeå ghi, theo tyû giaù bình quaân lieân ngaân haøng ngaøy 2/1 cho 6 thaùng ñaàu naêm vaø ngaøy 1/7 cho 6 thaùng cuoái naêm.
B42: Töø coät 12 ñeán coät 15 chæ aùp döïng ñoái vôùi ñôn vò thöïc hieän thang, baûng löông Nhaø nöôùc.
B43: Coät 12: ghi heä soá phuï caáp chöùc vuï (neáu coù).
B44: Coät 13: ghi % thaâm nieân vöôït khung (neáu coù).
B45: Coät 14: ghi % thaâm nieân ngheà (neáu coù).
B46: Coät 15: ghi heä soá phuï caáp khu vöïc (neáu coù).
B47: Coät 16: neáu coù tham gia BHTN thì ñaùnh daáu (x) vaøo, khoâng tham gia BHTN ñeå troáng.
B48: Coät 17: ghi töø thaùng/naêm baét ñaàu laøm vieäc chính thöùc theo HÑLÑ hoaëc QÑ tuyeån duïng
B49: Coät 18: ghi ñaày ñuû soá, ngaøy QÑ hoaëc HÑLÑ. Neáu ngöôøi lao ñoäng laøm ngheà, coâng vieäc ñaëc bieät naëng nhoïc, ñoäc haïi thì ghi kyù hieäu chöõ (A); naëng nhoïc, ñoäc haïi ghi kyù hieäu baèng chöõ (B).
M51: Hoàng Thị Hằng