A2: Teân ñôn vò: Vina Genuwin | J2: ="Soá:..........Thaùng " & MONTH(AA4) &" Naêm"& YEAR(AA4) -> Soá:..........Thaùng 1 Naêm2012 | W2: Đơn vị cần ghi đầy đủ caùc tieâu chí töø coät 1 ñeán coät 26 | AA2: Thaùng baùo caùo | AB2: Löông traàn | AC2: Löông toái thieåu chung | AD2: Lãi Truy Thu
A3: Maõ ñôn vò: 0123456 | P3: Mẫu D02-TS (Ban hành kèm theo QĐsố 1111/QĐ-BHXH ngày 25/10/2011 của BHXH VN) | AD3: BHXH | AE3: BHYT | AF3: BHTN
A4: Ñòa chæ: 364 coäng hoøa, Taân Bình , Tp.HCM quaän taân bình | AA4: 40909 | AB4: 16600000 | AC4: 830000 | AD4: 0,875% | AE4: 7.4999999999999997E-3 | AF4: 8.7500000000000008E-3
A5: Ñieän thoaïi ñôn vò: 0902954563
A6: A. PHAÀN CHI TIEÁT
A7: Soá TT | B7: Hoï vaø teân | C7: Soá soå BHXH | D7: Ngaøy thaùng naêm sinh | E7: Nữ (x) | F7: Nôi Khaùm Chöõa Beänh | H7: Soá CMND | I7: Caáp baäc, c/vuï, chöùc danh ngheà, ñ/kieän, nôi laøm vieäc | J7: Möùc ñoùng cuõ | N7: Möùc ñoùng môùi | R7: Töø thaùng naêm | S7: Ñeán thaùng naêm | T7: Tỷ lệ bổ sung | U7: Ñaõ coù soå BHXH(x) | V7: Ghi Chuù | W7: Maõ Phoøng Ban | X7: Ngaøy caáp | Y7: Nôi caáp | Z7: Hoä Khaåu thöôøng truù hoaëc taïm truù | AA7: SOÁ PHAÙT SINH | AG7: SOÁ THAÙNG | AH7: ÑIEÀU CHÆNH SOÁ PHAÛI ÑOÙNG | AY7: Số Tháng Truy Thu | AZ7: Lãi Truy Thu
J9: Tieàn löông | K9: Phuï caáp | N9: Tieàn löông | O9: Phuï caáp | AA9: BHYT | AC9: BHTN | AE9: BHXH | AH9: BHYT | AJ9: BHTN | AL9: BHXH | AZ9: BHXH | BA9: BHYT | BB9: BHTN
F10: Tỉnh | G10: Bệnh Viện | K10: CV | L10: TNVK % | M10: TN ngheà % | O10: CV | P10: TNVK % | Q10: TN ngheà % | AA10: TAÊNG | AB10: GIAÛM | AC10: TAÊNG | AD10: GIAÛM | AE10: TAÊNG | AF10: GIAÛM | AH10: TAÊNG | AI10: GIAÛM | AJ10: TAÊNG | AK10: GIAÛM | AL10: TAÊNG | AM10: GIAÛM
A11: 1 | B11: 2 | C11: =B11+1 -> 3 | D11: =C11+1 -> 4 | E11: =D11+1 -> 5 | F11: =E11+1 -> 6 | G11: =F11+1 -> 7 | H11: =G11+1 -> 8 | I11: =H11+1 -> 9 | J11: =I11+1 -> 10 | K11: =J11+1 -> 11 | L11: =K11+1 -> 12 | M11: =L11+1 -> 13 | N11: =M11+1 -> 14 | O11: =N11+1 -> 15 | P11: =O11+1 -> 16 | Q11: =P11+1 -> 17 | R11: =Q11+1 -> 18 | S11: =R11+1 -> 19 | T11: =S11+1 -> 20 | U11: =T11+1 -> 21 | V11: =U11+1 -> 22 | W11: =V11+1 -> 23 | X11: =W11+1 -> 24 | Y11: =X11+1 -> 25 | Z11: =Y11+1 -> 26
A12: II | B12: Giảm | AA12: =IF(AND(AO12=$AA$4,OR(T12=28.5%,T12=30.5%)),IF(AR12>AQ12,AR12-AQ12,0),0) -> 0 | AB12: =IF(AND(AO12=$AA$4,OR(T12=28.5%,T12=30.5%)),IF(AQ12>AR12,AQ12-AR12,0),0) -> 0 | AC12: =IF(AND(AO12=$AA$4,OR(T12=2%,T12=30.5%)),IF(AR12>AQ12,AR12-AQ12,0),0) -> 0 | AD12: =IF(AND(AO12=$AA$4,OR(T12=2%,T12=30.5%)),IF(AQ12>AR12,AQ12-AR12,0),0) -> 0 | AE12: =IF(AND(AO12=$AA$4,OR(T12=24%,OR(T12=28.5%,OR(T12=28.5%,T12=30.5%)))),IF(AR12>AQ12,AR12-AQ12,0),0) -> 0 | AF12: =IF(AND(AO12=$AA$4,OR(T12=22%,OR(T12=24%,OR(T12=26.5%,T12=28.5%)))),IF(AQ12>AR12,AQ12-AR12,0),0) -> 0 | AG12: =IF(OR((AO12<>$AA$4),(AND((T12=4.5%),(AN12=AO12)))),DATEDIF(AN12,AO12,"m")+1,DATEDIF(AN12,AO12,"m")) -> 0 | AH12: =IF(OR(T12=4.5%,OR(T12=28.5%,T12=30.5%,T12=26.5%)),AG12*MAX((AR12-AQ12),0)*4.5%,0) -> 0 | AI12: =IF(OR(T12=4.5%,OR(T12=28.5%,T12=30.5%,T12=26.5%)),AG12*MAX(AQ12-AR12,0)*4.5%,0) -> 0 | AJ12: =IF(OR(T12=2%,T12=30.5%,AND((T12=28.5%),YEAR(AO12)<2012)),AG12*MAX((AR12-AQ12),0)*2%,0) -> 0 | AK12: =IF(OR(T12=2%,T12=30.5%, AND((T12=28.5%),YEAR(AO12)<2012)),AG12*MAX(AQ12-AR12,0)*2%,0) -> 0 | AL12: =IF(OR(T12=24%,OR(T12=28.5%,T12=30.5%,T12=26.5%)),IF(YEAR(AN12)=2011,AG12*MAX((AR12-AQ12),0)*22%,AG12*MAX((AR12-AQ12),0)*24%),0) -> 0 | AM12: =IF(OR(T12=24%,T12=26%,OR(T12=28.5%,T12=30.5%,T12=26.5%)),IF(YEAR(AN12)=2011,AG12*MAX(AQ12-AR12,0)*22%,AG12*MAX(AQ12-AR12,0)*24%),0) -> 0 | AN12: =IF(R12<>"",R12,$AA$4) -> 40909 | AO12: =IF(S12<>"",S12,$AA$4) -> 40909 | AP12: =DATE(YEAR($AA$4),MONTH($AA$4)-1,DAY($AA$4)) -> 40878 | AQ12: =IF(J12>$AB$4,$AB$4,J12) -> 0 | AR12: =IF(N12>$AB$4,$AB$4,N12) -> 0 | AS12: =IF(AND(AB12>0,AR12=0),1,0) -> 0 | AT12: =IF(AND(AF12>0,AR12=0),1,0) -> 0 | AU12: =IF(AND(AD12>0,AR12=0),1,0) -> 0 | AV12: =IF(AND(AA12>0,AQ12=0),1,0) -> 0 | AW12: =IF(AND((AE12>0),(AQ12=0)),1,0) -> 0 | AX12: =IF(AND((AC12>0),(AQ12=0)),1,0) -> 0 | AY12: =IF(OR(T12=4.5%,AN12>AP12),0,(DATEDIF(AN12,AP12,"m"))+1) -> 0 | AZ12: =IF(OR(T12=4.5%,T12=2%,AY12=1,AQ12>AR12),0,IF(YEAR(AN12)<2010,laitt(AG12,AY12,MAX(AR12-AQ12)*20%,0.875%),IF(YEAR(AN12)<2012,laitt(AG12,AY12,MAX(AR12-AQ12)*22%,0.875%),laitt(AG12,AY12,MAX(AR12-AQ12)*24%,0.875%)))) -> 0 | BA12: =IF(OR(AND(YEAR(AN12)<=2009,T12=20%),AND(YEAR(AN12)<2010,T12=22%),AND(YEAR(AN12)<2012,T12=24%),R12=26%,AQ12>AR12,T12=4.5%,AY12=1),0,IF(YEAR(AN12)<2010,laitt(AG12,AY12,(AR12-AQ12)*3%,0.75%),laitt(AG12,AY12,(AR12-AQ12)*4.5%,0.75%))) -> 0 | BB12: =IF(OR(YEAR(AN12)<2009,AND(YEAR(AN12)>=2010,T12=26.5%),AND(YEAR(AN12)>2012,T12=28.5%),T12=4.5%,AQ12>AR12,AY12=1),0,laitt(AG12,AY12,(AR12-AQ12)*2%,0.875%)) -> 0
A13: II.1 | B13: Giaûm lao Ñoäng | AA13: =IF(AND(AO13=$AA$4,OR(T13=28.5%,T13=30.5%)),IF(AR13>AQ13,AR13-AQ13,0),0) -> 0 | AB13: =IF(AND(AO13=$AA$4,OR(T13=28.5%,T13=30.5%)),IF(AQ13>AR13,AQ13-AR13,0),0) -> 0 | AC13: =IF(AND(AO13=$AA$4,OR(T13=2%,T13=30.5%)),IF(AR13>AQ13,AR13-AQ13,0),0) -> 0 | AD13: =IF(AND(AO13=$AA$4,OR(T13=2%,T13=30.5%)),IF(AQ13>AR13,AQ13-AR13,0),0) -> 0 | AE13: =IF(AND(AO13=$AA$4,OR(T13=24%,OR(T13=28.5%,OR(T13=28.5%,T13=30.5%)))),IF(AR13>AQ13,AR13-AQ13,0),0) -> 0 | AF13: =IF(AND(AO13=$AA$4,OR(T13=22%,OR(T13=24%,OR(T13=26.5%,T13=28.5%)))),IF(AQ13>AR13,AQ13-AR13,0),0) -> 0 | AG13: =IF(OR((AO13<>$AA$4),(AND((T13=4.5%),(AN13=AO13)))),DATEDIF(AN13,AO13,"m")+1,DATEDIF(AN13,AO13,"m")) -> 0 | AH13: =IF(OR(T13=4.5%,OR(T13=28.5%,T13=30.5%,T13=26.5%)),AG13*MAX((AR13-AQ13),0)*4.5%,0) -> 0 | AI13: =IF(OR(T13=4.5%,OR(T13=28.5%,T13=30.5%,T13=26.5%)),AG13*MAX(AQ13-AR13,0)*4.5%,0) -> 0 | AJ13: =IF(OR(T13=2%,T13=30.5%,AND((T13=28.5%),YEAR(AO13)<2012)),AG13*MAX((AR13-AQ13),0)*2%,0) -> 0 | AK13: =IF(OR(T13=2%,T13=30.5%, AND((T13=28.5%),YEAR(AO13)<2012)),AG13*MAX(AQ13-AR13,0)*2%,0) -> 0 | AL13: =IF(OR(T13=24%,OR(T13=28.5%,T13=30.5%,T13=26.5%)),IF(YEAR(AN13)=2011,AG13*MAX((AR13-AQ13),0)*22%,AG13*MAX((AR13-AQ13),0)*24%),0) -> 0 | AM13: =IF(OR(T13=24%,T13=26%,OR(T13=28.5%,T13=30.5%,T13=26.5%)),IF(YEAR(AN13)=2011,AG13*MAX(AQ13-AR13,0)*22%,AG13*MAX(AQ13-AR13,0)*24%),0) -> 0 | AN13: =IF(R13<>"",R13,$AA$4) -> 40909 | AO13: =IF(S13<>"",S13,$AA$4) -> 40909 | AP13: =DATE(YEAR($AA$4),MONTH($AA$4)-1,DAY($AA$4)) -> 40878 | AQ13: =IF(J13>$AB$4,$AB$4,J13) -> 0 | AR13: =IF(N13>$AB$4,$AB$4,N13) -> 0 | AS13: =IF(AND(AB13>0,AR13=0),1,0) -> 0 | AT13: =IF(AND(AF13>0,AR13=0),1,0) -> 0 | AU13: =IF(AND(AD13>0,AR13=0),1,0) -> 0 | AV13: =IF(AND(AA13>0,AQ13=0),1,0) -> 0 | AW13: =IF(AND((AE13>0),(AQ13=0)),1,0) -> 0 | AX13: =IF(AND((AC13>0),(AQ13=0)),1,0) -> 0 | AY13: =IF(OR(T13=4.5%,AN13>AP13),0,(DATEDIF(AN13,AP13,"m"))+1) -> 0 | AZ13: =IF(OR(T13=4.5%,T13=2%,AY13=1,AQ13>AR13),0,IF(YEAR(AN13)<2010,laitt(AG13,AY13,MAX(AR13-AQ13)*20%,0.875%),IF(YEAR(AN13)<2012,laitt(AG13,AY13,MAX(AR13-AQ13)*22%,0.875%),laitt(AG13,AY13,MAX(AR13-AQ13)*24%,0.875%)))) -> 0 | BA13: =IF(OR(AND(YEAR(AN13)<=2009,T13=20%),AND(YEAR(AN13)<2010,T13=22%),AND(YEAR(AN13)<2012,T13=24%),R13=26%,AQ13>AR13,T13=4.5%,AY13=1),0,IF(YEAR(AN13)<2010,laitt(AG13,AY13,(AR13-AQ13)*3%,0.75%),laitt(AG13,AY13,(AR13-AQ13)*4.5%,0.75%))) -> 0 | BB13: =IF(OR(YEAR(AN13)<2009,AND(YEAR(AN13)>=2010,T13=26.5%),AND(YEAR(AN13)>2012,T13=28.5%),T13=4.5%,AQ13>AR13,AY13=1),0,laitt(AG13,AY13,(AR13-AQ13)*2%,0.875%)) -> 0
A14: a | B14: Giaûm traû theû kòp thôøi | AL14: =IF(OR(T14=24%,OR(T14=28.5%,T14=30.5%,T14=26.5%)),IF(YEAR(AN14)=2011,AG14*MAX((AR14-AQ14),0)*22%,AG14*MAX((AR14-AQ14),0)*24%),0) -> 0 | AM14: =IF(OR(T14=24%,T14=26%,OR(T14=28.5%,T14=30.5%,T14=26.5%)),IF(YEAR(AN14)=2011,AG14*MAX(AQ14-AR14,0)*22%,AG14*MAX(AQ14-AR14,0)*24%),0) -> 0 | AY14: =IF(OR(T14=4.5%,AN14>AP14),0,(DATEDIF(AN14,AP14,"m"))+1) -> 1 | AZ14: =IF(OR(T14=4.5%,T14=2%,AY14=1,AQ14>AR14),0,IF(YEAR(AN14)<2010,laitt(AG14,AY14,MAX(AR14-AQ14)*20%,0.875%),IF(YEAR(AN14)<2012,laitt(AG14,AY14,MAX(AR14-AQ14)*22%,0.875%),laitt(AG14,AY14,MAX(AR14-AQ14)*24%,0.875%)))) -> 0 | BA14: =IF(OR(AND(YEAR(AN14)<=2009,T14=20%),AND(YEAR(AN14)<2010,T14=22%),AND(YEAR(AN14)<2012,T14=24%),R14=26%,AQ14>AR14,T14=4.5%,AY14=1),0,IF(YEAR(AN14)<2010,laitt(AG14,AY14,(AR14-AQ14)*3%,0.75%),laitt(AG14,AY14,(AR14-AQ14)*4.5%,0.75%))) -> 0 | BB14: =IF(OR(YEAR(AN14)<2009,AND(YEAR(AN14)>=2010,T14=26.5%),AND(YEAR(AN14)>2012,T14=28.5%),T14=4.5%,AQ14>AR14,AY14=1),0,laitt(AG14,AY14,(AR14-AQ14)*2%,0.875%)) -> 0
A15: 1 | B15: Nguyeãn Hoaøng Leâ Anh | C15: 7408000111 | D15: 15/6/1982 | I15: CN | J15: 2300000 | R15: 40909 | S15: 40909 | T15: 0.30499999999999999 | AA15: =IF(AND(AO15=$AA$4,OR(T15=28.5%,T15=30.5%)),IF(AR15>AQ15,AR15-AQ15,0),0) -> 0 | AB15: =IF(AND(AO15=$AA$4,OR(T15=28.5%,T15=30.5%)),IF(AQ15>AR15,AQ15-AR15,0),0) -> 2300000 | AC15: =IF(AND(AO15=$AA$4,OR(T15=2%,T15=30.5%)),IF(AR15>AQ15,AR15-AQ15,0),0) -> 0 | AD15: =IF(AND(AO15=$AA$4,OR(T15=2%,T15=30.5%)),IF(AQ15>AR15,AQ15-AR15,0),0) -> 2300000 | AE15: =IF(AND(AO15=$AA$4,OR(T15=24%,OR(T15=28.5%,OR(T15=28.5%,T15=30.5%)))),IF(AR15>AQ15,AR15-AQ15,0),0) -> 0 | AF15: =IF(AND(AO15=$AA$4,OR(T15=24%,OR(T15=26%,OR(T15=28.5%,T15=30.5%)))),IF(AQ15>AR15,AQ15-AR15,0),0) -> 2300000 | AG15: =IF(OR((AO15<>$AA$4),(AND((T15=4.5%),(AN15=AO15)))),DATEDIF(AN15,AO15,"m")+1,DATEDIF(AN15,AO15,"m")) -> 0 | AH15: =IF(OR(T15=4.5%,OR(T15=28.5%,T15=30.5%,T15=26.5%)),AG15*MAX((AR15-AQ15),0)*4.5%,0) -> 0 | AI15: =IF(OR(T15=4.5%,OR(T15=28.5%,T15=30.5%,T15=26.5%)),AG15*MAX(AQ15-AR15,0)*4.5%,0) -> 0 | AJ15: =IF(OR(T15=2%,T15=30.5%,AND((T15=28.5%),YEAR(AO15)<2012)),AG15*MAX((AR15-AQ15),0)*2%,0) -> 0 | AK15: =IF(OR(T15=2%,T15=30.5%, AND((T15=28.5%),YEAR(AO15)<2012)),AG15*MAX(AQ15-AR15,0)*2%,0) -> 0 | AL15: =IF(OR(T15=24%,OR(T15=28.5%,T15=30.5%,T15=26.5%)),IF(YEAR(AN15)=2011,AG15*MAX((AR15-AQ15),0)*22%,AG15*MAX((AR15-AQ15),0)*24%),0) -> 0 | AM15: =IF(OR(T15=24%,T15=26%,OR(T15=28.5%,T15=30.5%,T15=26.5%)),IF(YEAR(AN15)=2011,AG15*MAX(AQ15-AR15,0)*22%,AG15*MAX(AQ15-AR15,0)*24%),0) -> 0 | AN15: =IF(R15<>"",R15,$AA$4) -> 40909 | AO15: =IF(S15<>"",S15,$AA$4) -> 40909 | AP15: =DATE(YEAR($AA$4),MONTH($AA$4)-1,DAY($AA$4)) -> 40878 | AQ15: =IF(J15>$AB$4,$AB$4,J15) -> 2300000 | AR15: =IF(N15>$AB$4,$AB$4,N15) -> 0 | AS15: =IF(AND(AB15>0,AR15=0),1,0) -> 1 | AT15: =IF(AND(AF15>0,AR15=0),1,0) -> 1 | AU15: =IF(AND(AD15>0,AR15=0),1,0) -> 1 | AV15: =IF(AND(AA15>0,AQ15=0),1,0) -> 0 | AW15: =IF(AND((AE15>0),(AQ15=0)),1,0) -> 0 | AX15: =IF(AND((AC15>0),(AQ15=0)),1,0) -> 0 | AY15: =IF(OR(T15=4.5%,AN15>AP15),0,(DATEDIF(AN15,AP15,"m"))+1) -> 0 | AZ15: =IF(OR(T15=4.5%,T15=2%,AY15=1,AQ15>AR15),0,IF(YEAR(AN15)<2010,laitt(AG15,AY15,MAX(AR15-AQ15)*20%,0.875%),IF(YEAR(AN15)<2012,laitt(AG15,AY15,MAX(AR15-AQ15)*22%,0.875%),laitt(AG15,AY15,MAX(AR15-AQ15)*24%,0.875%)))) -> 0 | BA15: =IF(OR(AND(YEAR(AN15)<=2009,T15=20%),AND(YEAR(AN15)<2010,T15=22%),AND(YEAR(AN15)<2012,T15=24%),R15=26%,AQ15>AR15,T15=4.5%,AY15=1),0,IF(YEAR(AN15)<2010,laitt(AG15,AY15,(AR15-AQ15)*3%,0.75%),laitt(AG15,AY15,(AR15-AQ15)*4.5%,0.75%))) -> 0 | BB15: =IF(OR(YEAR(AN15)<2009,AND(YEAR(AN15)>=2010,T15=26.5%),AND(YEAR(AN15)>2012,T15=28.5%),T15=4.5%,AQ15>AR15,AY15=1),0,laitt(AG15,AY15,(AR15-AQ15)*2%,0.875%)) -> 0
AA16: =SUM(AA12:AA15) -> 0 | AB16: =SUM(AB12:AB15) -> 2300000 | AC16: =SUM(AC12:AC15) -> 0 | AD16: =SUM(AD12:AD15) -> 2300000 | AE16: =SUM(AE12:AE15) -> 0 | AF16: =SUM(AF12:AF15) -> 2300000 | AH16: =SUM(AH12:AH15) -> 0 | AI16: =SUM(AI12:AI15) -> 0 | AJ16: =SUM(AJ12:AJ15) -> 0 | AK16: =SUM(AK12:AK15) -> 0 | AL16: =SUM(AL12:AL15) -> 0 | AM16: =SUM(AM12:AM15) -> 0 | AS16: =SUM(AS12:AS15) -> 1 | AT16: =SUM(AT12:AT15) -> 1 | AU16: =SUM(AU12:AU15) -> 1 | AV16: =SUM(AV12:AV15) -> 0 | AW16: =SUM(AW12:AW15) -> 0 | AX16: =SUM(AX12:AX15) -> 0 | AZ16: =SUM(AZ12:AZ15) -> 0 | BA16: =SUM(BA12:BA15) -> 0 | BB16: =SUM(BB12:BB15) -> 0
A18: B. PHAÀN TOÅNG HÔÏP CHUNG
B19: Phaùt sinh | D19: Baûo hieåm y teá | K19: Baûo hieåm thaát nghieäp | S19: Baûo hieåm xaõ hoäi
D20: Taêng | H20: Giaûm | K20: Taêng | O20: Giaûm | S20: Taêng | T20: Giaûm
B21: 1.Soá lao ñoäng | D21: 2 | H21: 4 | K21: 1 | O21: 4 | S21: 2 | T21: 4
B22: 2.Quyõ löông | D22: 19953000 | H22: 10600000 | K22: 2853000 | O22: 10600000 | S22: 19953000 | T22: 10600000
B23: 3.Soá Phaûi ñoùng | D23: 897885 | H23: 477000 | K23: 57060 | O23: 212000 | S23: 4788720 | T23: 2544000
B24: 4.Ñieàu chænh soá phaûi ñoùng | D24: 2347628.8353999006 | H24: 355500 | K24: 312646.72662969923 | O24: 208000 | S24: 3988334.0755292946 | T24: 2288000
A25: Phần CQ BHXH ghi: | L25: Phaàn ñôn vò ghi:
B26: Tổng số tờ khai:
B27: Tồng số sổ BHXH ñeà nghò caáp:
B28: Toång soá theû BHYT ñeà nghò caáp: | I28: Thôøi haïn töø……. ñeán……………… | L28: Toång soá theû BHYT ñeà nghò caáp: | T28: Thôøi haïn töø……. ñeán………………
S29: Ngaøy 12 thaùng 01 naêm 2011
B30: Caùn boä thu | F30: Caùn boä soå, theû | M30: Ngöôøi laäp bieåu | S30: Thuû tröôûng ñôn vò

A1: DANH SAÙCH LAO ÑOÄNG THAM GIA BAÛO HIEÅM XAÕ HOÄI, BAÛO HIEÅM Y TEÁ