1: <%=p_company_name%>
2: <%=p_cmp_add%> | E2: DAILY CASH REPORT | I2: APPROVAL | J2: REPORTER | K2: C / A | L2: MANAGER | M2: COO | N2: PRESIDENT
E4: YESTERDAY EXCHANGE RATE
E5: USD | F5: 19,050
E6: EUR | F6: 23,098
7: 1.YESTERDAY CASH STATUS | C7: <%=p_From%>
8: DIVISION | B8: UNIT | C8: BEFORE YESTERDAY BALANCE | D8: YESTERDAY INCOME | J8: YESTERDAY PAYMENT | N8: YESTERDAY BALANCE
D9: ORG.INCOME | E9: EXCHANGE | F9: RECEIVING | G9: SETTELEMENT BALANCE | H9: TOTAL | J9: ORG.PAYMENT | K9: WITHDRAWAL | L9: REMIT | M9: TOTAL
10: <%=dt1.Rows[i][0]%> | A10: <%=dt1.Rows[i][1]%> | B10: <%=dt1.Rows[i][2]%> | C10: <%=dt1.Rows[i][3]%> | D10: <%=dt1.Rows[i][4]%> | E10: <%=dt1.Rows[i][5]%> | F10: <%=dt1.Rows[i][6]%> | G10: <%=dt1.Rows[i][7]%> | H10: =SUM(E10:H10) -> <%=dt1.Rows[i][8]%> | J10: <%=dt1.Rows[i][9]%> | K10: <%=dt1.Rows[i][10]%> | L10: <%=dt1.Rows[i][11]%> | M10: =SUM(K10:M10) -> <%=dt1.Rows[i][12]%> | N10: =SUM(D10-N10+I10) -> <%=dt1.Rows[i][13]%>
A11: BANK TOTAL | C11: US$ | D11: 789,789.00 | E11: 789,789.00 | F11: 67,567.00 | G11: 56,757.00 | H11: 567.00 | I11: =E11+F11+G11+H11 -> 914,680.00 | K11: 567,567.00 | L11: 456,456.00 | M11: 456,456.00 | N11: =SUM(K11:M11) -> 1,480,479.00 | O11: 456,456.00
C12: VND | D12: 789,789 | E12: 789,789 | F12: 567,567 | G12: 56,767 | H12: 567,567 | I12: =E12+F12+G12+H12 -> 1,981,690 | K12: 456,456 | L12: 456,456 | M12: 456,456 | N12: 45,645 | O12: 456,456
A13: CASH | C13: US$ | D13: 45,675.00 | E13: 567,567 | F13: 43,645.00 | G13: 456,456.00 | H13: 456,456 | I13: =SUM(E13:H13) -> 1,524,124.00 | K13: 456,456.00 | L13: 456,456.00 | M13: 456,456 | N13: =SUM(K13:M13) -> 1,369,368.00 | O13: =SUM(D13+E13+F13+H13+G13-N13) -> 200,431.00
C14: VND | D14: 64,500,052 | E14: 567,567 | F14: 456,456 | G14: 456,456 | H14: 456,456 | I14: =SUM(E14:H14) -> 1,936,935 | K14: 456,456 | L14: 456,456 | M14: 456,456 | N14: =SUM(K14:M14) -> 1,369,368 | O14: =SUM(D14+E14+F14+H14+G14-N14) -> 65,067,619
A15: TOTAL | C15: US$ | D15: =SUM(D11+D13) -> 835,464.00 | E15: =SUM(E11+E13) -> 1,357,356.00 | F15: =SUM(F11+F13) -> 111,212.00 | G15: =SUM(G11+G13) -> 513,213.00 | H15: =SUM(H11+H13) -> 457,023.00 | I15: =SUM(I11+I13) -> 2,438,804.00 | K15: =SUM(K11+K13) -> 1,024,023.00 | L15: =SUM(L11+L13) -> 2,912.00 | M15: =SUM(M11+M13) -> 912,912.00 | N15: =SUM(N11+N13) -> 2,849,847.00 | O15: =SUM(O11+O13) -> 656,887.00
C16: VND | D16: =SUM(D12+D14) -> 65,289,841 | E16: =SUM(E12+E14) -> 1,357,356 | F16: =SUM(F12+F14) -> 1,024,023 | G16: =SUM(G12+G14) -> 513,223 | H16: =SUM(H12+H14) -> 1,024,023 | I16: =SUM(I12+I14) -> 3,918,625 | K16: =SUM(K12+K14) -> 912,912 | L16: =SUM(L12+L14) -> 912,912 | M16: =SUM(M12+M14) -> 912,912 | N16: =SUM(N12+N14) -> 1,415,013 | O16: =SUM(O12+O14) -> 65,524,075
A18: 2.TODAY CASH SCHEDULE | D18: 7/2/2010
A19: DIVISION | C19: UNIT | D19: YESTERDAY BALANCE | E19: TODAY INCOME | K19: TODAY PAYMENT | O19: TODAY FORCAST BALANCE
E20: ORG.INCOME | F20: EXCHANGE | G20: RECEIVING | H20: SETTELEMENT BALANCE | I20: TOTAL | K20: ORG.PAYMENT | L20: WITHDRAWAL | M20: REMIT | N20: TOTAL
21: BANK | A21: <%=dt3.Rows[j][1]%> | B21: <%=dt3.Rows[j][2]%> | C21: <%=dt3.Rows[j][3]%> | D21: <%=dt3.Rows[j][4]%> | E21: <%=dt3.Rows[j][5]%> | F21: <%=dt3.Rows[j][6]%> | G21: <%=dt3.Rows[j][7]%> | H21: <%=dt3.Rows[j][8]%> | J21: <%=dt3.Rows[j][9]%> | K21: <%=dt3.Rows[j][10]%> | L21: <%=dt3.Rows[j][11]%> | M21: <%=dt3.Rows[j][12]%> | N21: =D21+I21-N21 -> <%=dt3.Rows[j][13]%>
A22: BANK TOTAL | C22: US$ | D22: 45,645.00 | E22: 456,456.00 | F22: 34,535.00 | G22: 456.00 | H22: 34.00 | I22: 45,646.00 | K22: 34,535.00 | L22: 456.00 | M22: 456.00 | N22: 4,564.00 | O22: 456,456.00
C23: VND | D23: 456,456 | E23: 2,343 | F23: 3,453 | G23: 456 | H23: 456 | I23: 45,646 | K23: 3,535 | L23: 56,776 | M23: 789 | N23: 4,564 | O23: 456,456
A24: CASH | C24: US$ | D24: =O13 -> 200,431.00 | E24: 45,645 | F24: 456 | G24: 46,354.00 | H24: 345 | I24: =SUM(E24:H24) -> 92,800.00 | K24: 34,535.00 | L24: 56,756 | M24: 567 | N24: =SUM(K24:M24) -> 91,858.00 | O24: =SUM(D24+E24+G24+F24-N24) -> 201,028.00
C25: VND | D25: =O14 -> 65,067,619 | E25: 456,456 | F25: 4,564 | G25: 456 | H25: 34,535 | I25: =SUM(E25:H25) -> 496,011 | K25: 567 | L25: 345 | M25: 645 | N25: =SUM(K25:M25) -> 1,557 | O25: =SUM(D25+E25+G25+F25-N25) -> 65,527,538
A26: TOTAL | C26: US$ | D26: =SUM(D22+D24) -> 246,076.00 | E26: =SUM(E22+E24) -> 502,101.00 | F26: =SUM(F22+F24) -> 34,991.00 | G26: =SUM(G22+G24) -> 46,810.00 | H26: =SUM(H22+H24) -> 379.00 | I26: =SUM(I22+I24) -> 138,446.00 | K26: =SUM(K22+K24) -> 69,070.00 | L26: =SUM(L22+L24) -> 57,212.00 | M26: =SUM(M22+M24) -> 1,023.00 | N26: =SUM(N22+N24) -> 96,422.00 | O26: =SUM(O22+O24) -> 657484
C27: VND | D27: =SUM(D23+D25) -> 65,524,075 | E27: =SUM(E23+E25) -> 458,799 | F27: =SUM(F23+F25) -> 8,017 | G27: =SUM(G23+G25) -> 912 | H27: =SUM(H23+H25) -> 34,991 | I27: =SUM(I23+I25) -> 541,657 | K27: =SUM(K23+K25) -> 4,102 | L27: =SUM(L23+L25) -> 57,121 | M27: =SUM(M23+M25) -> 1,434 | N27: =SUM(N23+N25) -> 6,121 | O27: =SUM(O23+O25) -> 65,983,994