A1: <%=l_cmp_name%> | E1: Mẫu số: B01 - DN | G1: <%=l_cmp_name%> | K1: Form: B 01 - DN
A2: Địa chỉ: <%=l_cmp_add %> | C2: (Ban hành theo Quyết định số 15/2006/QĐ-BTC ngày | G2: Địa chỉ: <%=l_cmp_add %> | I2: (Ban hành theo Quyết định số 15/2006/QĐ-BTC ngày
C3: 20 tháng 03 năm 2006 của Bộ trường Bộ Tài chính) | I3: 20 tháng 03 năm 2006 của Bộ trường Bộ Tài chính)
A5: BẢNG CÂN ĐỐI KẾ TOÁN | G5: BALANCE SHEET
A6: Tại ngày <%=l_date.Substring(6, 2)%>/<%=l_date.Substring(4, 2)%>/<%=l_date.Substring(0, 4)%> | G6: As at <%=l_date.Substring(6, 2)%>/<%=l_date.Substring(4, 2)%>/<%=l_date.Substring(0, 4)%>
E7: (Đơn vị tính: VND) | K7: (Currency : VND)
A8: TÀI SẢN | B8: Mã số | C8: Thuyết minh | D8: Số dư cuối kỳ | E8: Số đầu năm | G8: ASSETS | H8: CODE | I8: NOTES | J8: CLOSING | K8: OPENNING
A9: 1 | B9: 2 | C9: 3 | D9: 4 | E9: 5 | G9: =A9 -> 1 | H9: =B9 -> 2 | I9: =C9 -> 3 | J9: =D9 -> 4 | K9: =E9 -> 5
A10: <%=strBegin%><%= dt_detail.Rows[i][0].ToString() %><%=strEnd%> | B10: <%=strBegin%><%= dt_detail.Rows[i][3].ToString() %><%=strEnd%> | C10: <%=strBegin%><%= dt_detail.Rows[i][4].ToString() %><%=strEnd%> | D10: <%=strBegin%><%= dt_detail.Rows[i][5].ToString() %><%=strEnd%> | E10: <%=strBegin%><%= dt_detail.Rows[i][6].ToString() %><%=strEnd%> | G10: <%=strBegin%><%= dt_detail.Rows[i][1].ToString() %><%=strEnd%> | H10: <%=strBegin%><%= dt_detail.Rows[i][3].ToString() %><%=strEnd%> | I10: <%=strBegin%><%= dt_detail.Rows[i][4].ToString() %><%=strEnd%> | J10: <%=strBegin%><%= dt_detail.Rows[i][5].ToString() %><%=strEnd%> | K10: <%=strBegin%><%= dt_detail.Rows[i][6].ToString() %><%=strEnd%>
A11: Tổng cộng tài sản (270 = 100 + 200) | B11: <%=strBegin%><%= dt_detail.Rows[i][3].ToString() %><%=strEnd%> | C11: <%=strBegin%><%= dt_detail.Rows[i][4].ToString() %><%=strEnd%> | D11: <%=strBegin%><%= dt_detail.Rows[i][5].ToString() %><%=strEnd%> | E11: <%=strBegin%><%= dt_detail.Rows[i][6].ToString() %><%=strEnd%> | G11: TOTAL ASSETS (270 = 100 + 200) | H11: <%=strBegin%><%= dt_detail.Rows[i][3].ToString() %><%=strEnd%> | I11: <%=strBegin%><%= dt_detail.Rows[i][4].ToString() %><%=strEnd%> | J11: <%=strBegin%><%= dt_detail.Rows[i][5].ToString() %><%=strEnd%> | K11: <%=strBegin%><%= dt_detail.Rows[i][6].ToString() %><%=strEnd%>
A14: NGUỒN VỐN | B14: Mã số | C14: Thuyết minh | D14: =+D8 -> Số dư cuối kỳ | E14: =+E8 -> Số đầu năm | G14: RESOURCES | H14: CODE | I14: NOTES | J14: =+J8 -> CLOSING | K14: =+K8 -> OPENNING
A15: 1 | B15: 2 | C15: 3 | D15: 4 | E15: 5 | G15: 1 | H15: 2 | I15: 3 | J15: 4 | K15: 5
A16: <%=strBegin%><%= dt_detail.Rows[i][0].ToString() %><%=strEnd%> | B16: <%=strBegin%><%= dt_detail.Rows[i][3].ToString() %><%=strEnd%> | C16: <%=strBegin%><%= dt_detail.Rows[i][4].ToString() %><%=strEnd%> | D16: <%=strBegin%><%= dt_detail.Rows[i][5].ToString() %><%=strEnd%> | E16: <%=strBegin%><%= dt_detail.Rows[i][6].ToString() %><%=strEnd%> | G16: <%=strBegin%><%= dt_detail.Rows[i][1].ToString() %><%=strEnd%> | H16: <%=strBegin%><%= dt_detail.Rows[i][3].ToString() %><%=strEnd%> | I16: <%=strBegin%><%= dt_detail.Rows[i][4].ToString() %><%=strEnd%> | J16: <%=strBegin%><%= dt_detail.Rows[i][5].ToString() %><%=strEnd%> | K16: <%=strBegin%><%= dt_detail.Rows[i][6].ToString() %><%=strEnd%>
A17: Tổng cộng nguồn vốn (440 = 300 + 400) | B17: <%=strBegin%><%= dt_detail.Rows[i][3].ToString() %><%=strEnd%> | C17: <%=strBegin%><%= dt_detail.Rows[i][4].ToString() %><%=strEnd%> | D17: <%=strBegin%><%= dt_detail.Rows[i][5].ToString() %><%=strEnd%> | E17: <%=strBegin%><%= dt_detail.Rows[i][6].ToString() %><%=strEnd%> | G17: TOTAL LIABILITIES AND OWNERS' EQUITY (440 = 300 + 400) | H17: <%=strBegin%><%= dt_detail.Rows[i][3].ToString() %><%=strEnd%> | I17: <%=strBegin%><%= dt_detail.Rows[i][4].ToString() %><%=strEnd%> | J17: <%=strBegin%><%= dt_detail.Rows[i][5].ToString() %><%=strEnd%> | K17: <%=strBegin%><%= dt_detail.Rows[i][6].ToString() %><%=strEnd%>
A19: TÀI KHOẢN NGOÀI BẢNG | G19: OFF BALANCE SHEET ITEMS
A21: Khoản mục | C21: TM | D21: =+D65 -> Số dư cuối kỳ | E21: =+E65 -> Số đầu năm | G21: ITEMS | I21: Notes | J21: =+J65 -> CLOSING | K21: =+K65 -> OPENNING
A22: 1. Tài sản thuê ngoài | D22: 0 | E22: 0 | G22: 1. Operating lease assets | J22: =+D109 -> 0 | K22: =+E109 -> 0
A23: 2. Vật tư, hàng hóa nhận giữ hộ, nhận ký gửi | D23: 0 | E23: 0 | G23: 2. Goods held under trust or for processing | J23: =+D110 -> 0 | K23: =+E110 -> 0
A24: 3. Hàng hóa nhận bán hộ, nhận ký gửi | D24: 0 | E24: 0 | G24: 3. Goods received on consignment for sale | J24: =+D111 -> 0 | K24: =+E111 -> 0
A25: 4. Nợ khó đòi đã xữ lý | D25: 0 | E25: 0 | G25: 4. Bad debts written off | J25: =+D112 -> 0 | K25: =+E112 -> 0
A26: 5. Ngọai tệ các lọai | D26: 0 | E26: 0 | G26: 5. Foreign currencies | J26: =+D113 -> 0 | K26: =+E113 -> 0
A27: 6. Dự tóan chi sự nghiệp, dự án | D27: 0 | E27: 0 | G27: 6. Subsidies of state budget | J27: =+D114 -> 0 | K27: =+E114 -> 0
D29: Tại ngày <%=l_date.Substring(6, 2)%>/<%=l_date.Substring(4, 2)%>/<%=l_date.Substring(0, 4)%> | J29: At dated <%=l_date.Substring(6, 2)%>/<%=l_date.Substring(4, 2)%>/<%=l_date.Substring(0, 4)%>
A30: Người lập biểu | B30: Kế Toán Trưởng | D30: Tổng Giám Đốc | G30: Prepared by | H30: Chief Accountant | J30: General Director
A31: (Ký, họ tên) | B31: (Ký, họ tên) | D31: (Ký, họ tên, đóng dấu) | G31: (Sign, Fullname) | H31: (Sign, Fullname) | J31: (Sign, Fullname, Stamp)