F1: Document No. : | G1: Doc. No. | J1: March 01st, 2011 | L1: □ Routine
L2: □ Urgent
L3: □ Confidential
D4: Checked by | G4: Reviewed by | K4: Approved by
A5: Signature
D13: Mr. Tran Quoc Viet | G13: Mr. Kim Hee Jung | K13: Mr. Cho Han Un
A14: Subject: Request of 1st progress payment for ……. Co., Ltd.
A15: I would like to propose the payment to B.O.D as follows:
B16: 1/ Project summmany
B17: Project Name: | E17: CHARM PLAZA
B18: Project Code: | E18: CT0234
B19: Project Period: | E19: 1 Oct 2010 ~ 30 Nov 2012
B20: 2/ Contents | E20: Request of 1st progress payment for ……... Co., Ltd.
B21: Subcontractor: | E21: ……... Co., Ltd.
B22: Contract No.: | E22: 2011-………….
B23: Scope of work | E23: Water work
B24: Contract Period: | E24: 10 Mar 2011 ~ 29 Feb 2012
B25: Contrac Value | E25: 3,400,349,036 VND (Excluding 10%VAT)
A27: No | B27: Description | D27: Value Work Done Status | E27: Previous Payment | G27: This Month | H27: Acc. Amount | K27: Balance | L27: Remarks
A28: 1 | B28: Net Amount | D28: 3400349036 | E28: 0 | F28: =102788.85*629.98 -> 64754919.723000005 | J28: =E28+F28 -> 64754919.723000005 | K28: =D28-J28 -> 3335594116.277 | L28: Excl.VAT
B29: VAT 10% | D29: =D28*10% -> 340034903.60000002 | E29: =E28*10% -> 0 | G29: =ROUND(F28*10%,0) -> 6475492 | J29: =E29+G29 -> 6475492 | K29: =D29-J29 -> 333559411.60000002
B30: Total Workdone | D30: =D28+D29 -> 3740383939.5999999 | E30: =E28+E29 -> 0 | G30: =F28+G29 -> 71230411.723000005 | J30: =E30+G30 -> 71230411.723000005 | K30: =D30-J30 -> 3669153527.8769999 | L30: Incl.VAT
A31: 2 | B31: Advance (10%) | D31: =D28*10% -> 340034903.60000002 | E31: =D28*10% -> 340034903.60000002 | J31: =E31+G31 -> 340034903.60000002 | K31: =D31-J31 -> 0
A32: 3 | B32: Retention (5%) | D32: =D28*5% -> 170017451.80000001
A33: 4 | B33: Deducting
B34: Advance | D34: =D31 -> 340034903.60000002 | G34: =F28*10% -> 6475491.9723000005 | J34: =E34+G34 -> 6475491.9723000005 | K34: =D34-J34 -> 333559411.62770003
B35: Retention (5%) | D35: =D32 -> 170017451.80000001 | F35: =F33+F34 -> 0 | G35: =F28*5% -> 3237745.9861500002 | H35: =H33+H34 -> 0 | I35: =I33+I34 -> 0 | J35: =E35+G35 -> 3237745.9861500002 | K35: =D35-J35 -> 166779705.81385002
B36: Total Deduct | D36: =D34+D35 -> 510052355.40000004 | F36: =F34+F35 -> 0 | G36: =SUM(G33:G35) -> 9713237.9584500007 | H36: =H34+H35 -> 0 | I36: =I34+I35 -> 0 | J36: =J34+J35 -> 9713237.9584500007 | K36: =D36-J36 -> 500339117.44155002
A38: 5 | B38: This Payment | D38: =D30 -> 3740383939.5999999 | E38: =E30+E31-E36 -> 340034903.60000002 | F38: =F30+F31-F35 -> 0 | G38: =G30-G36 -> 61517173.76455 | J38: =E38+G38 -> 401552077.36454999 | K38: =D38-J38 -> 3338831862.2354498 | L38: =J38/D38*100% -> 0.10735584470707901
A40: Paid Amount Status
A42: Contract Value | D42: Previous | E42: This time payment | F42: This Time | G42: Accumulation | H42: Accumulation | I42: Accumulation | J42: Total Amount | K42: Balance | L42: Remarks
A43: =D38 -> 3740383939.5999999 | D43: =E38 -> 340034903.60000002 | E43: =G38 -> 61517173.76455 | G43: =J38 -> 401552077.36454999 | J43: =G43 -> 401552077.36454999 | K43: =K38 -> 3338831862.2354498 | L43: =+L38 -> 0.10735584470707901
A45: * Enclosure(s): | D45: 1/ Request of payment
D46: 2/ Minutes of acceptance
A49: I would like to get your consideration | K49: POSCO E&C-VIETNAM

A1: PROPOSAL SHEET