C5: Requesting Department: Golf Course Maint Date of Request: 25.02.2010
I6: Direct issue? Stock
C7: Reason of Request:Chemical for Insecticide & Fungicide
G9: Mothly Consumption
B11: 500 | C11: Pack ( 100g ) | E11: Ridomil 68 WG | H11: Nil | J11: Ni | K11: =37000/1.05 -> 35238.095238095237 | N11: =K11*B11 -> 17619047.619047619
B12: 150 | C12: Botle ( 450ml ) | E12: Lorsban 30EC | H12: Nil | J12: Nil | K12: =100000/1.05 -> 95238.095238095237 | N12: =K12*B12 -> 14285714.285714285
B13: 50 | C13: Pack ( 1kg ) | E13: Ankzeb 80 WP | H13: Nil | J13: Nil | K13: =100000/1.05 -> 95238.095238095237 | N13: =K13*B13 -> 4761904.7619047621
B14: 500 | C14: Pack( 100g) | E14: Daconil 75 WP | H14: Nil | J14: Nil | K14: =30000/1.05 -> 28571.428571428569 | N14: =K14*B14 -> 14285714.285714284
B15: 60 | C15: Botle (500ml) | E15: Bavistin 50 FL | H15: Nil | J15: Nil | K15: 166667 | N15: =K15*B15 -> 10000020
N17: =N11+N12+N13+N14+N15 -> 60952400.952380948
N18: =N17*5% -> 3047620.0476190476
N19: =SUM(N17, N18) -> 64000020.999999993
A28: 3. All Capex (Capital Expenditure) with a value of US$4,000 and more for each item require Owner's approval signatory on the Purchase Request (PR) / Purchase Contract / Agreement