C5: Requesting Department: Golf Course Maint Date of Request: 15.04.2010 | F5: Expected date of Delivery: 10 days | I5: New Request? New | L5: PR No. | N5: Selected Vendor No.1
I6: Direct issue? Stock
C7: Reason of Request:Caddie towel serve for golf course | F7: Budgeted? Amount | I7: Payment terms: | L7: PO Reference No.
A8: Managed by Watertree
B9: Qty Needed | C9: Unit of Measure | D9: Item Code | E9: Description | F9: Expense Code | G9: Mothly Consumption | H9: Qty on Hand | J9: Unit Price | N9: Total Amount
A10: No. | H10: Qty | I10: Days | J10: Last Order | K10: Vendor-1 | L10: Vendor-2 | M10: Vendor-3
A11: 1 | B11: 600 | E11: Caddie towel | K11: 41500 | N11: =K11*B11 -> 24900000
A12: 2 | B12: 400 | E12: Towel box | K12: 9000 | N12: =K12*B12 -> 3600000
A17: Requested by: | F17: Approved by: | L17: Sub-total | N17: =N11+N12+N13+N14+N15 -> 28500000
A18: Initiator (Name, Position) | E18: Department Head (Name) | F18: Controller | H18: General Manager | J18: Owner Representative | L18: VAT | N18: =N17*10% -> 2850000
A19: Signatures: | L19: sub-total | N19: =SUM(N17, N18) -> 31350000
L20: Other costs (pl specify)
A23: Date: | E23: Date: | F23: Date: | H23: Date: | J23: Date: | L23: Total Amount
A24: Remark: Caddie towel serve for golf course
A27: Notes:
A28: 1. All Purchase Requests (PR), Expenditure Contracts/Agreements with a value of US$25,000 and more require Owner's signatory approval.on the PR / Contract / Agreement
A29: 2. All Purchase Requests (PR), Expenditure Contracts/Agreements for a contract period of 1 year and more require Owner's signatory approval on the PR / Contract / Agreement
A30: 3. All Capex (Capital Expenditure) with a value of US$4,000 and more for each item require Owner's approval signatory on the Purchase Request (PR) / Purchase Contract / Agreement

A1: PURCHASE REQUEST