D2: GUEST FOLIO | O2: GUEST FOLIO | Z2: GUEST FOLIO
D3: First copy : Original | H3: Print Date: | J3: dddmmmyyyy:adas | O3: Second copy : To customer | S3: Print Date: | U3: dddmmmyyyy:adas | Z3: Third copy : Internal | AD3: Print Date: | AF3: dddmmmyyyy:adas
A5: Guest Name : | C5: Lee Hyung Geun | H5: Cashier# : | J5: nguyen van quyen | L5: Guest Name : | N5: Lee Hyung Geun | S5: Cashier# : | U5: nguyen van quyen | W5: Guest Name : | Y5: Lee Hyung Geun | AD5: Cashier# : | AF5: nguyen van quyen
A6: Arrival : | C6: 17d02m2011 | H6: Departure: | J6: 21d02m2011 | L6: Arrival : | N6: 17d02m2011 | S6: Departure: | U6: 21d02m2011 | W6: Arrival : | Y6: 17d02m2011 | AD6: Departure: | AF6: 21d02m2011
A7: Room# : | C7: 502 | H7: Nights : | J7: 4 | L7: Room# : | N7: 502 | S7: Nights : | U7: 4 | W7: Room# : | Y7: 502 | AD7: Nights : | AF7: 4
A8: Hotel: | L8: Hotel: | W8: Hotel:
A9: No. | B9: Description | H9: Price | J9: Amount | L9: No. | M9: Description | S9: Price | U9: Amount | W9: No. | X9: Description | AD9: Price | AF9: Amount
A10: 1 | B10: Room fee | J10: 12534000 | L10: 1 | M10: Room fee | U10: 12534000 | W10: 1 | X10: Room fee | AF10: 12534000
B11: Sub Total | J11: 12534000 | M11: Sub Total | U11: 12534000 | X11: Sub Total | AF11: 12534000
E12: Discount amount : | J12: 0 | P12: Discount amount : | U12: 0 | AA12: Discount amount : | AF12: 0
E13: Advance amount : | J13: 0 | P13: Advance amount : | U13: 0 | AA13: Advance amount : | AF13: 0
E14: Services charge(5%) : | J14: 1162794.4 | P14: Services charge(5%) : | U14: 1162794.4 | AA14: Services charge(5%) : | AF14: 1162794.4
E15: VAT amount (10%) : | J15: 2441868.24 | P15: VAT amount (10%) : | U15: 2441868.24 | AA15: VAT amount (10%) : | AF15: 2441868.24
G16: Total due(Hotel) : | J16: 454654 | R16: Total due(Hotel) : | U16: 454654 | AC16: Total due(Hotel) : | AF16: 454654
A17: Golf: | L17: Golf: | W17: Golf:
A18: No | B18: Description | J18: Amount | L18: No | M18: Description | U18: Amount | W18: No | X18: Description | AF18: Amount
A19: 1 | B19: 161102180008-DRIVING RANGE | J19: 54234 | L19: 1 | M19: 161102180008-DRIVING RANGE | U19: 54234 | W19: 1 | X19: 161102180008-DRIVING RANGE | AF19: 54234
B20: Sub Total | J20: =SUM(J19:K19) -> 54234 | M20: Sub Total | U20: =SUM(U19:V19) -> 54234 | X20: Sub Total | AF20: =SUM(AF19:AG19) -> 54234
E21: Total paid amount : | J21: =J16+J20 -> 508888 | P21: Total paid amount : | U21: =U16+U20 -> 508888 | AA21: Total paid amount : | AF21: =AF16+AF20 -> 508888
E22: Exchange rate (VND / USD): 20,880 | J22: $ | K22: 53145 | P22: Exchange rate (VND / USD): 20,880 | U22: $ | V22: 53145 | AA22: Exchange rate (VND / USD): 20,880 | AF22: $ | AG22: 53145
E23: Payment method: | P23: Payment method: | AA23: Payment method:
A25: In word: | L25: In word: | W25: In word:
A26: Hai Mươi Sáu Triệu Tám Trăm Sáu Mươi Nghìn Năm Trăm Năm Mươi Mốt Đồng | L26: Hai Mươi Sáu Triệu Tám Trăm Sáu Mươi Nghìn Năm Trăm Năm Mươi Mốt Đồng | W26: Hai Mươi Sáu Triệu Tám Trăm Sáu Mươi Nghìn Năm Trăm Năm Mươi Mốt Đồng
B28: Cashier's Signature | G28: Guest's Signature | M28: Cashier's Signature | R28: Guest's Signature | X28: Cashier's Signature | AC28: Guest's Signature
A33: Công ty TNHH AMB Vina | L33: Công ty TNHH AMB Vina | W33: Công ty TNHH AMB Vina
A34: Website: www.songgia.com / E-mail : marketing@songgia.com | L34: Website: www.songgia.com / E-mail : marketing@songgia.com | W34: Website: www.songgia.com / E-mail : marketing@songgia.com
A35: Chỉ xuất hóa đơn GTGT không quá 5 ngày kể từ ngày in bill và phải cùng tháng. | L35: Chỉ xuất hóa đơn GTGT không quá 5 ngày kể từ ngày in bill và phải cùng tháng. | W35: Chỉ xuất hóa đơn GTGT không quá 5 ngày kể từ ngày in bill và phải cùng tháng.
A36: Only issue VAT invoice less than 5 days from the date in the bill and in the same month. | L36: Only issue VAT invoice less than 5 days from the date in the bill and in the same month. | W36: Only issue VAT invoice less than 5 days from the date in the bill and in the same month.
A38: AMB Vina Co., Ltd | L38: AMB Vina Co., Ltd | W38: AMB Vina Co., Ltd
A39: Song Gia Resort Complex Golf & Coutry Club | L39: Song Gia Resort Complex Golf & Coutry Club | W39: Song Gia Resort Complex Golf & Coutry Club
A40: Chợ Tổng, Lưu Kiếm, Thủy Nguyên, Hải Phòng - Việt Nam | L40: Chợ Tổng, Lưu Kiếm, Thủy Nguyên, Hải Phòng - Việt Nam | W40: Chợ Tổng, Lưu Kiếm, Thủy Nguyên, Hải Phòng - Việt Nam
A41: Tel.: (+84)31-396-3333 / Fax.: (+84)31-396-3332 | L41: Tel.: (+84)31-396-3333 / Fax.: (+84)31-396-3332 | W41: Tel.: (+84)31-396-3333 / Fax.: (+84)31-396-3332